"","mes","ms","FECHA","PRECIPmm","EVAPmm","tmin","tmax","date","año"
"1","Enero ",1,"01/01/1941","0","3.3",3.5,19.5,1941-01-01,"1941"
"2","Enero ",1,"02/01/1941","0","3.8",2.5,21.5,1941-01-02,"1941"
"3","Enero ",1,"03/01/1941","0","5.8",5.5,23.5,1941-01-03,"1941"
"4","Enero ",1,"04/01/1941","0","5.7",7.5,19,1941-01-04,"1941"
"5","Enero ",1,"05/01/1941","0","5",-4.5,21.5,1941-01-05,"1941"
"6","Enero ",1,"06/01/1941","0","4.9",-2.5,23.5,1941-01-06,"1941"
"7","Enero ",1,"07/01/1941","0","8.1",-3.5,23.5,1941-01-07,"1941"
"8","Enero ",1,"08/01/1941","0","5.3",-1,24.5,1941-01-08,"1941"
"9","Enero ",1,"09/01/1941","0.1","3.6",3,20.5,1941-01-09,"1941"
"10","Enero ",1,"10/01/1941","0.2","2.9",7,19,1941-01-10,"1941"
"11","Enero ",1,"11/01/1941","0.2","3.6",5,22,1941-01-11,"1941"
"12","Enero ",1,"12/01/1941","0","5.1",7.5,24.5,1941-01-12,"1941"
"13","Enero ",1,"13/01/1941","0","6.4",3.5,23,1941-01-13,"1941"
"14","Enero ",1,"14/01/1941","0","6.5",3.5,22.3,1941-01-14,"1941"
"15","Enero ",1,"15/01/1941","0","6.8",2,19.5,1941-01-15,"1941"
"16","Enero ",1,"16/01/1941","0","4.9",5,18,1941-01-16,"1941"
"17","Enero ",1,"17/01/1941","0","4.5",-1.5,21.5,1941-01-17,"1941"
"18","Enero ",1,"18/01/1941","0","4.7",-5,13,1941-01-18,"1941"
"19","Enero ",1,"19/01/1941","0","4.4",-1.5,20,1941-01-19,"1941"
"20","Enero ",1,"20/01/1941","0","5.5",-3,23.5,1941-01-20,"1941"
"21","Enero ",1,"21/01/1941","0","5.3",3.5,21,1941-01-21,"1941"
"22","Enero ",1,"22/01/1941","0","6",2,23,1941-01-22,"1941"
"23","Enero ",1,"23/01/1941","0","6.2",3.5,23.5,1941-01-23,"1941"
"24","Enero ",1,"24/01/1941","0","6.1",-5,23,1941-01-24,"1941"
"25","Enero ",1,"25/01/1941","0","7.8",0.5,24.5,1941-01-25,"1941"
"26","Enero ",1,"26/01/1941","0","7.3",-1,25,1941-01-26,"1941"
"27","Enero ",1,"27/01/1941","0","5.1",1,23.5,1941-01-27,"1941"
"28","Enero ",1,"28/01/1941","0","7",2.5,24.5,1941-01-28,"1941"
"29","Enero ",1,"29/01/1941","0","4.4",3.5,22,1941-01-29,"1941"
"30","Enero ",1,"30/01/1941","7.5","4",6.5,21.5,1941-01-30,"1941"
"31","Enero ",1,"31/01/1941","42.5","3.6",9.5,16,1941-01-31,"1941"
"32","Enero ",1,"01/01/1942","0","1.7",4,22.5,1942-01-01,"1942"
"33","Enero ",1,"02/01/1942","0","9",7,20.5,1942-01-02,"1942"
"34","Enero ",1,"03/01/1942","0","8",6.5,21,1942-01-03,"1942"
"35","Enero ",1,"04/01/1942","0","7.7",-3,22.5,1942-01-04,"1942"
"36","Enero ",1,"05/01/1942","0","5.5",-2.5,23.5,1942-01-05,"1942"
"37","Enero ",1,"06/01/1942","0","1.9",0.5,22.5,1942-01-06,"1942"
"38","Enero ",1,"07/01/1942","0","4.6",8.5,24,1942-01-07,"1942"
"39","Enero ",1,"08/01/1942","0","6.5",0.5,24.5,1942-01-08,"1942"
"40","Enero ",1,"09/01/1942","0","5.5",0,26.5,1942-01-09,"1942"
"41","Enero ",1,"10/01/1942","0","4.4",1.5,26,1942-01-10,"1942"
"42","Enero ",1,"11/01/1942","0","3",1,21,1942-01-11,"1942"
"43","Enero ",1,"12/01/1942","0","3.8",-1.5,23,1942-01-12,"1942"
"44","Enero ",1,"13/01/1942","0","4.6",1,24.5,1942-01-13,"1942"
"45","Enero ",1,"14/01/1942","0","4.9",6,24.5,1942-01-14,"1942"
"46","Enero ",1,"15/01/1942","0","3.1",3.5,20.5,1942-01-15,"1942"
"47","Enero ",1,"16/01/1942","0","6",1.5,23.5,1942-01-16,"1942"
"48","Enero ",1,"17/01/1942","0","6",1.5,24,1942-01-17,"1942"
"49","Enero ",1,"18/01/1942","0","5.9",0.5,22,1942-01-18,"1942"
"50","Enero ",1,"19/01/1942","0","4.7",1.5,23.5,1942-01-19,"1942"
"51","Enero ",1,"20/01/1942","0","3.3",1.5,19,1942-01-20,"1942"
"52","Enero ",1,"21/01/1942","27.5","0.7",7.5,12,1942-01-21,"1942"
"53","Enero ",1,"22/01/1942","0","0.8",2.5,13,1942-01-22,"1942"
"54","Enero ",1,"23/01/1942","0","3.9",-0.5,23,1942-01-23,"1942"
"55","Enero ",1,"24/01/1942","0","4.3",3,23.5,1942-01-24,"1942"
"56","Enero ",1,"25/01/1942","0","4.4",1.5,24,1942-01-25,"1942"
"57","Enero ",1,"26/01/1942","0","5.4",0.5,25.5,1942-01-26,"1942"
"58","Enero ",1,"27/01/1942","0","4.6",0.5,24,1942-01-27,"1942"
"59","Enero ",1,"28/01/1942","0","5.8",0.5,25.5,1942-01-28,"1942"
"60","Enero ",1,"29/01/1942","0","5.2",7.5,19,1942-01-29,"1942"
"61","Enero ",1,"30/01/1942","0","6.8",3,24,1942-01-30,"1942"
"62","Enero ",1,"31/01/1942","0","5.5",2.5,22.5,1942-01-31,"1942"
"63","Enero ",1,"01/01/1943","0","4.9",-4.5,22,1943-01-01,"1943"
"64","Enero ",1,"02/01/1943","0","5.6",-5,23,1943-01-02,"1943"
"65","Enero ",1,"03/01/1943","0","5.5",2,24,1943-01-03,"1943"
"66","Enero ",1,"04/01/1943","0","5.4",3,25.5,1943-01-04,"1943"
"67","Enero ",1,"05/01/1943","0","4.3",2,19,1943-01-05,"1943"
"68","Enero ",1,"06/01/1943","30","6.8",3.5,17,1943-01-06,"1943"
"69","Enero ",1,"07/01/1943","15","10",5,17,1943-01-07,"1943"
"70","Enero ",1,"08/01/1943","Nulo","6",5,17,1943-01-08,"1943"
"71","Enero ",1,"09/01/1943","0","3.2",2,17,1943-01-09,"1943"
"72","Enero ",1,"10/01/1943","0","4.3",4,18,1943-01-10,"1943"
"73","Enero ",1,"11/01/1943","10","1",3,27,1943-01-11,"1943"
"74","Enero ",1,"12/01/1943","0","3.8",3,20,1943-01-12,"1943"
"75","Enero ",1,"13/01/1943","0","3.2",0,19.5,1943-01-13,"1943"
"76","Enero ",1,"14/01/1943","0","6",-3,21,1943-01-14,"1943"
"77","Enero ",1,"15/01/1943","0","11.5",0,22.5,1943-01-15,"1943"
"78","Enero ",1,"16/01/1943","0","9.5",0,21,1943-01-16,"1943"
"79","Enero ",1,"17/01/1943","0","2.7",0,18,1943-01-17,"1943"
"80","Enero ",1,"18/01/1943","0","4.6",4,20.5,1943-01-18,"1943"
"81","Enero ",1,"19/01/1943","0","8.7",0,22,1943-01-19,"1943"
"82","Enero ",1,"20/01/1943","0","7.3",0,22,1943-01-20,"1943"
"83","Enero ",1,"21/01/1943","0","7",0,23,1943-01-21,"1943"
"84","Enero ",1,"22/01/1943","0","6.9",4,23,1943-01-22,"1943"
"85","Enero ",1,"23/01/1943","0","6.1",4,26,1943-01-23,"1943"
"86","Enero ",1,"24/01/1943","0","9.6",-2,26,1943-01-24,"1943"
"87","Enero ",1,"25/01/1943","0","4.7",0,23,1943-01-25,"1943"
"88","Enero ",1,"26/01/1943","0","7.3",3.5,22,1943-01-26,"1943"
"89","Enero ",1,"27/01/1943","0","8.2",-2,22,1943-01-27,"1943"
"90","Enero ",1,"28/01/1943","0","7.1",2,20,1943-01-28,"1943"
"91","Enero ",1,"29/01/1943","0","7.9",-1,20.5,1943-01-29,"1943"
"92","Enero ",1,"30/01/1943","0","6.8",0,24,1943-01-30,"1943"
"93","Enero ",1,"31/01/1943","0","Nulo",-3,22.5,1943-01-31,"1943"
"94","Enero ",1,"01/01/1944","0","7.2",2,12,1944-01-01,"1944"
"95","Enero ",1,"02/01/1944","0","1.1",-2,16,1944-01-02,"1944"
"96","Enero ",1,"03/01/1944","0","6.4",-6,24,1944-01-03,"1944"
"97","Enero ",1,"04/01/1944","0","4.5",-5,20,1944-01-04,"1944"
"98","Enero ",1,"05/01/1944","0","3.6",0,19.5,1944-01-05,"1944"
"99","Enero ",1,"06/01/1944","0","3.5",1.5,21,1944-01-06,"1944"
"100","Enero ",1,"07/01/1944","0","7.8",7,20,1944-01-07,"1944"
"101","Enero ",1,"08/01/1944","0","2.1",-2,22,1944-01-08,"1944"
"102","Enero ",1,"09/01/1944","0","3.4",-4,15,1944-01-09,"1944"
"103","Enero ",1,"10/01/1944","0","4.5",-10,19.5,1944-01-10,"1944"
"104","Enero ",1,"11/01/1944","0","4.8",-5,18.5,1944-01-11,"1944"
"105","Enero ",1,"12/01/1944","0","7.9",0,20,1944-01-12,"1944"
"106","Enero ",1,"13/01/1944","0","4",-5,8,1944-01-13,"1944"
"107","Enero ",1,"14/01/1944","0","3.4",-10,13.5,1944-01-14,"1944"
"108","Enero ",1,"15/01/1944","0","3",-10.5,21.5,1944-01-15,"1944"
"109","Enero ",1,"16/01/1944","0","2.5",-9.5,22,1944-01-16,"1944"
"110","Enero ",1,"17/01/1944","0","3.3",-9,15,1944-01-17,"1944"
"111","Enero ",1,"18/01/1944","0","2.4",-5,20.5,1944-01-18,"1944"
"112","Enero ",1,"19/01/1944","0","2.1",-4.5,19,1944-01-19,"1944"
"113","Enero ",1,"20/01/1944","0","3.9",-6,19.5,1944-01-20,"1944"
"114","Enero ",1,"21/01/1944","0","4.3",-5.5,24,1944-01-21,"1944"
"115","Enero ",1,"22/01/1944","0","5.9",-3,20.5,1944-01-22,"1944"
"116","Enero ",1,"23/01/1944","0","6.7",-4.5,23,1944-01-23,"1944"
"117","Enero ",1,"24/01/1944","0","8.2",-1,17,1944-01-24,"1944"
"118","Enero ",1,"25/01/1944","30","7.9",0,17.5,1944-01-25,"1944"
"119","Enero ",1,"26/01/1944","0","6.2",4,14.5,1944-01-26,"1944"
"120","Enero ",1,"27/01/1944","0","2.8",-4.5,17.5,1944-01-27,"1944"
"121","Enero ",1,"28/01/1944","0","2.9",-3.5,16.5,1944-01-28,"1944"
"122","Enero ",1,"29/01/1944","0","4.9",2.5,15,1944-01-29,"1944"
"123","Enero ",1,"30/01/1944","0","5.1",-4,23,1944-01-30,"1944"
"124","Enero ",1,"31/01/1944","0.1","5",0,22.5,1944-01-31,"1944"
"125","Enero ",1,"01/01/1945","0","4.9",-2,24,1945-01-01,"1945"
"126","Enero ",1,"02/01/1945","0","3.5",-3,26,1945-01-02,"1945"
"127","Enero ",1,"03/01/1945","0","4.4",2,27.5,1945-01-03,"1945"
"128","Enero ",1,"04/01/1945","19","1",2.5,22,1945-01-04,"1945"
"129","Enero ",1,"05/01/1945","35","3.1",6,20.5,1945-01-05,"1945"
"130","Enero ",1,"06/01/1945","0","4.4",6.5,24,1945-01-06,"1945"
"131","Enero ",1,"07/01/1945","0.1","3.2",0,22,1945-01-07,"1945"
"132","Enero ",1,"08/01/1945","0","3",-1,25.5,1945-01-08,"1945"
"133","Enero ",1,"09/01/1945","0","2.5",0,23.5,1945-01-09,"1945"
"134","Enero ",1,"10/01/1945","0","5.1",-1,25.5,1945-01-10,"1945"
"135","Enero ",1,"11/01/1945","0","6",-1.5,25,1945-01-11,"1945"
"136","Enero ",1,"12/01/1945","0","4.9",2,27,1945-01-12,"1945"
"137","Enero ",1,"13/01/1945","0","6.3",6,23,1945-01-13,"1945"
"138","Enero ",1,"14/01/1945","0","4.4",0,21,1945-01-14,"1945"
"139","Enero ",1,"15/01/1945","0","2.3",-3,20.5,1945-01-15,"1945"
"140","Enero ",1,"16/01/1945","0","6",-2.5,21,1945-01-16,"1945"
"141","Enero ",1,"17/01/1945","0","7.2",2,19.5,1945-01-17,"1945"
"142","Enero ",1,"18/01/1945","0","8.6",2,20.5,1945-01-18,"1945"
"143","Enero ",1,"19/01/1945","10","5",-1.5,21.5,1945-01-19,"1945"
"144","Enero ",1,"20/01/1945","0","4.1",-1,20,1945-01-20,"1945"
"145","Enero ",1,"21/01/1945","0","2.8",-1.5,19,1945-01-21,"1945"
"146","Enero ",1,"22/01/1945","0","5.4",-2,24.5,1945-01-22,"1945"
"147","Enero ",1,"23/01/1945","0","4.5",-1,22.5,1945-01-23,"1945"
"148","Enero ",1,"24/01/1945","0","7.4",5.5,25,1945-01-24,"1945"
"149","Enero ",1,"25/01/1945","0","6.2",6,26,1945-01-25,"1945"
"150","Enero ",1,"26/01/1945","0","6.9",1,24,1945-01-26,"1945"
"151","Enero ",1,"27/01/1945","0","7.7",2,25,1945-01-27,"1945"
"152","Enero ",1,"28/01/1945","0","8.2",0,24,1945-01-28,"1945"
"153","Enero ",1,"29/01/1945","0","7.9",0,25,1945-01-29,"1945"
"154","Enero ",1,"30/01/1945","0","4.3",1.5,21.5,1945-01-30,"1945"
"155","Enero ",1,"31/01/1945","0","5.5",3.5,25.5,1945-01-31,"1945"
"156","Enero ",1,"01/01/1946","0","4.9",-1,24.5,1946-01-01,"1946"
"157","Enero ",1,"02/01/1946","0","5.3",-1,23.5,1946-01-02,"1946"
"158","Enero ",1,"03/01/1946","0","7.2",2.5,21,1946-01-03,"1946"
"159","Enero ",1,"04/01/1946","0","7.8",2.5,21,1946-01-04,"1946"
"160","Enero ",1,"05/01/1946","0","8.7",3,18.5,1946-01-05,"1946"
"161","Enero ",1,"06/01/1946","0","6.6",3.5,19.5,1946-01-06,"1946"
"162","Enero ",1,"07/01/1946","0","2.3",4,7,1946-01-07,"1946"
"163","Enero ",1,"08/01/1946","0","1.1",-10,7.5,1946-01-08,"1946"
"164","Enero ",1,"09/01/1946","0","8.6",-5.5,17.5,1946-01-09,"1946"
"165","Enero ",1,"10/01/1946","0","6.8",-3,16.5,1946-01-10,"1946"
"166","Enero ",1,"11/01/1946","0","6.8",-6.5,19,1946-01-11,"1946"
"167","Enero ",1,"12/01/1946","0","3",-5,18.5,1946-01-12,"1946"
"168","Enero ",1,"13/01/1946","31","3.9",-3,18.5,1946-01-13,"1946"
"169","Enero ",1,"14/01/1946","0","2.2",5,14,1946-01-14,"1946"
"170","Enero ",1,"15/01/1946","0","1.9",1.5,14.5,1946-01-15,"1946"
"171","Enero ",1,"16/01/1946","0","1.9",-1.5,12.5,1946-01-16,"1946"
"172","Enero ",1,"17/01/1946","0","6.8",0,13,1946-01-17,"1946"
"173","Enero ",1,"18/01/1946","0","9.7",1.5,19.5,1946-01-18,"1946"
"174","Enero ",1,"19/01/1946","0","6.7",2.5,22.5,1946-01-19,"1946"
"175","Enero ",1,"20/01/1946","0","6",3,22.5,1946-01-20,"1946"
"176","Enero ",1,"21/01/1946","0","3.7",6.5,21.5,1946-01-21,"1946"
"177","Enero ",1,"22/01/1946","0","4.6",-3.5,10.5,1946-01-22,"1946"
"178","Enero ",1,"23/01/1946","0","3.8",-4.5,17.5,1946-01-23,"1946"
"179","Enero ",1,"24/01/1946","0","4.2",-5,18.5,1946-01-24,"1946"
"180","Enero ",1,"25/01/1946","0","6.1",-3.5,22.5,1946-01-25,"1946"
"181","Enero ",1,"26/01/1946","0","5.1",-3.5,21,1946-01-26,"1946"
"182","Enero ",1,"27/01/1946","0","7.1",-1.5,22.5,1946-01-27,"1946"
"183","Enero ",1,"28/01/1946","0","7.6",7.5,21,1946-01-28,"1946"
"184","Enero ",1,"29/01/1946","0","8.2",4,24,1946-01-29,"1946"
"185","Enero ",1,"30/01/1946","0","6",2.5,24,1946-01-30,"1946"
"186","Enero ",1,"31/01/1946","0","Nulo",3,21,1946-01-31,"1946"
"187","Enero ",1,"01/01/1947","0","3",-1,12,1947-01-01,"1947"
"188","Enero ",1,"02/01/1947","0","6.5",1,17,1947-01-02,"1947"
"189","Enero ",1,"03/01/1947","0","5.4",-1,18.5,1947-01-03,"1947"
"190","Enero ",1,"04/01/1947","70","3.1",-2,14,1947-01-04,"1947"
"191","Enero ",1,"05/01/1947","30","1.4",-4.5,1.5,1947-01-05,"1947"
"192","Enero ",1,"06/01/1947","0","0.8",-1,14,1947-01-06,"1947"
"193","Enero ",1,"07/01/1947","0","4.1",1,16.5,1947-01-07,"1947"
"194","Enero ",1,"08/01/1947","0","2.2",6.5,18,1947-01-08,"1947"
"195","Enero ",1,"09/01/1947","12","4.4",8,18.5,1947-01-09,"1947"
"196","Enero ",1,"10/01/1947","0","1.2",6,17.5,1947-01-10,"1947"
"197","Enero ",1,"11/01/1947","0","5.8",1.5,17.5,1947-01-11,"1947"
"198","Enero ",1,"12/01/1947","0","4.9",2,17.5,1947-01-12,"1947"
"199","Enero ",1,"13/01/1947","0","4.6",5,17,1947-01-13,"1947"
"200","Enero ",1,"14/01/1947","0","4",2,21.5,1947-01-14,"1947"
"201","Enero ",1,"15/01/1947","0","6",1.5,22,1947-01-15,"1947"
"202","Enero ",1,"16/01/1947","0","6.1",4.5,21.5,1947-01-16,"1947"
"203","Enero ",1,"17/01/1947","0","3.7",6.5,16,1947-01-17,"1947"
"204","Enero ",1,"18/01/1947","0","6.1",0,17.5,1947-01-18,"1947"
"205","Enero ",1,"19/01/1947","0","7.6",1.5,18,1947-01-19,"1947"
"206","Enero ",1,"20/01/1947","0","5.1",0,19.5,1947-01-20,"1947"
"207","Enero ",1,"21/01/1947","0","5.9",0,21,1947-01-21,"1947"
"208","Enero ",1,"22/01/1947","0","4.6",-1.5,22,1947-01-22,"1947"
"209","Enero ",1,"23/01/1947","0","6.4",1.5,21.5,1947-01-23,"1947"
"210","Enero ",1,"24/01/1947","0","6.9",1,22,1947-01-24,"1947"
"211","Enero ",1,"25/01/1947","0","2.8",-1,20,1947-01-25,"1947"
"212","Enero ",1,"26/01/1947","0","5.9",-1,21,1947-01-26,"1947"
"213","Enero ",1,"27/01/1947","0","4.7",-1,22.5,1947-01-27,"1947"
"214","Enero ",1,"28/01/1947","0","9.6",0,22,1947-01-28,"1947"
"215","Enero ",1,"29/01/1947","0","9.9",4,21,1947-01-29,"1947"
"216","Enero ",1,"30/01/1947","0","5.7",7.5,22.5,1947-01-30,"1947"
"217","Enero ",1,"31/01/1947","0","7.7",2,23,1947-01-31,"1947"
"218","Enero ",1,"01/01/1948","0","3.8",-3.5,18.5,1948-01-01,"1948"
"219","Enero ",1,"02/01/1948","0","6.2",2.5,20,1948-01-02,"1948"
"220","Enero ",1,"03/01/1948","0","4.7",0,16.5,1948-01-03,"1948"
"221","Enero ",1,"04/01/1948","2","2",-0.5,10,1948-01-04,"1948"
"222","Enero ",1,"05/01/1948","5","3.6",1,18.5,1948-01-05,"1948"
"223","Enero ",1,"06/01/1948","0","2.1",1,19,1948-01-06,"1948"
"224","Enero ",1,"07/01/1948","0","3.4",2,20.5,1948-01-07,"1948"
"225","Enero ",1,"08/01/1948","0","4.1",1.5,21,1948-01-08,"1948"
"226","Enero ",1,"09/01/1948","0","3.7",-1.5,20.5,1948-01-09,"1948"
"227","Enero ",1,"10/01/1948","0","6.3",1.5,21,1948-01-10,"1948"
"228","Enero ",1,"11/01/1948","0","3",2.5,20.5,1948-01-11,"1948"
"229","Enero ",1,"12/01/1948","0","4.1",6.5,21.5,1948-01-12,"1948"
"230","Enero ",1,"13/01/1948","0","4",4,20,1948-01-13,"1948"
"231","Enero ",1,"14/01/1948","0","3.4",1,16,1948-01-14,"1948"
"232","Enero ",1,"15/01/1948","0","3.5",3,17.5,1948-01-15,"1948"
"233","Enero ",1,"16/01/1948","0","5.2",1.5,17,1948-01-16,"1948"
"234","Enero ",1,"17/01/1948","0","4.8",0,16.5,1948-01-17,"1948"
"235","Enero ",1,"18/01/1948","0","3.5",2,12.5,1948-01-18,"1948"
"236","Enero ",1,"19/01/1948","0","5.5",-0.5,15,1948-01-19,"1948"
"237","Enero ",1,"20/01/1948","0","5.5",0,18.5,1948-01-20,"1948"
"238","Enero ",1,"21/01/1948","0","6",-1.5,19.5,1948-01-21,"1948"
"239","Enero ",1,"22/01/1948","0","6.5",-1,21.5,1948-01-22,"1948"
"240","Enero ",1,"23/01/1948","0","5.4",-1.5,19,1948-01-23,"1948"
"241","Enero ",1,"24/01/1948","0","10.1",-1,21.5,1948-01-24,"1948"
"242","Enero ",1,"25/01/1948","0","3.9",3.5,22.5,1948-01-25,"1948"
"243","Enero ",1,"26/01/1948","0","8",1,22,1948-01-26,"1948"
"244","Enero ",1,"27/01/1948","0","6.6",4,21,1948-01-27,"1948"
"245","Enero ",1,"28/01/1948","0","3.2",6.5,15,1948-01-28,"1948"
"246","Enero ",1,"29/01/1948","0","4.9",4,17.5,1948-01-29,"1948"
"247","Enero ",1,"30/01/1948","0","5.2",-1.5,18.2,1948-01-30,"1948"
"248","Enero ",1,"31/01/1948","0","3.8",-1,20.5,1948-01-31,"1948"
"249","Enero ",1,"01/01/1949","0","5.7",-1,23,1949-01-01,"1949"
"250","Enero ",1,"02/01/1949","0","9.6",0,17,1949-01-02,"1949"
"251","Enero ",1,"03/01/1949","0","7.5",6,16,1949-01-03,"1949"
"252","Enero ",1,"04/01/1949","0","5.6",3,17,1949-01-04,"1949"
"253","Enero ",1,"05/01/1949","0","2.7",1,17.5,1949-01-05,"1949"
"254","Enero ",1,"06/01/1949","0","2.9",-0.5,14.5,1949-01-06,"1949"
"255","Enero ",1,"07/01/1949","0","8.2",0,23,1949-01-07,"1949"
"256","Enero ",1,"08/01/1949","0","5.6",1,20.5,1949-01-08,"1949"
"257","Enero ",1,"09/01/1949","0","4.2",6,23,1949-01-09,"1949"
"258","Enero ",1,"10/01/1949","0","5.3",4,22.5,1949-01-10,"1949"
"259","Enero ",1,"11/01/1949","0","5.5",1.5,24,1949-01-11,"1949"
"260","Enero ",1,"12/01/1949","0","5.5",1.5,24,1949-01-12,"1949"
"261","Enero ",1,"13/01/1949","0","9.6",2,22,1949-01-13,"1949"
"262","Enero ",1,"14/01/1949","0","7.4",3,21,1949-01-14,"1949"
"263","Enero ",1,"15/01/1949","0","6.7",4.5,21,1949-01-15,"1949"
"264","Enero ",1,"16/01/1949","0","9",-1,19,1949-01-16,"1949"
"265","Enero ",1,"17/01/1949","0","3.5",-5.5,17,1949-01-17,"1949"
"266","Enero ",1,"18/01/1949","0","9.1",-3.5,21,1949-01-18,"1949"
"267","Enero ",1,"19/01/1949","0","2.7",-5,20,1949-01-19,"1949"
"268","Enero ",1,"20/01/1949","0","1.7",-4,15,1949-01-20,"1949"
"269","Enero ",1,"21/01/1949","0","0.9",6,15.5,1949-01-21,"1949"
"270","Enero ",1,"22/01/1949","0","5.2",9,15,1949-01-22,"1949"
"271","Enero ",1,"23/01/1949","15","3",5.5,19,1949-01-23,"1949"
"272","Enero ",1,"24/01/1949","5","5.8",2,16,1949-01-24,"1949"
"273","Enero ",1,"25/01/1949","0","5.6",6,17,1949-01-25,"1949"
"274","Enero ",1,"26/01/1949","0","8",3.5,19,1949-01-26,"1949"
"275","Enero ",1,"27/01/1949","0","6.5",2.5,22.5,1949-01-27,"1949"
"276","Enero ",1,"28/01/1949","0","9.2",-2,22.5,1949-01-28,"1949"
"277","Enero ",1,"29/01/1949","0","2.7",0.5,18.5,1949-01-29,"1949"
"278","Enero ",1,"30/01/1949","0","6.9",2,18.5,1949-01-30,"1949"
"279","Enero ",1,"31/01/1949","0","Nulo",-9,18.5,1949-01-31,"1949"
"280","Enero ",1,"01/01/1950","0","14.5",3,18,1950-01-01,"1950"
"281","Enero ",1,"02/01/1950","0","5.7",2.5,17,1950-01-02,"1950"
"282","Enero ",1,"03/01/1950","0","6.3",3.5,13.5,1950-01-03,"1950"
"283","Enero ",1,"04/01/1950","0","2.8",5,17,1950-01-04,"1950"
"284","Enero ",1,"05/01/1950","0","4.4",6,16,1950-01-05,"1950"
"285","Enero ",1,"06/01/1950","0","3.2",5,20,1950-01-06,"1950"
"286","Enero ",1,"07/01/1950","0","2.4",0,18.5,1950-01-07,"1950"
"287","Enero ",1,"08/01/1950","0","4.8",0,18,1950-01-08,"1950"
"288","Enero ",1,"09/01/1950","0","4.6",4.5,16.5,1950-01-09,"1950"
"289","Enero ",1,"10/01/1950","0","1.3",4,16,1950-01-10,"1950"
"290","Enero ",1,"11/01/1950","0","5.1",4.5,23,1950-01-11,"1950"
"291","Enero ",1,"12/01/1950","0","7",5,20.5,1950-01-12,"1950"
"292","Enero ",1,"13/01/1950","0","7.2",4,14,1950-01-13,"1950"
"293","Enero ",1,"14/01/1950","0","7",6.5,23,1950-01-14,"1950"
"294","Enero ",1,"15/01/1950","0","6.4",3,23,1950-01-15,"1950"
"295","Enero ",1,"16/01/1950","0","5.5",1,25,1950-01-16,"1950"
"296","Enero ",1,"17/01/1950","0","4.4",0,25,1950-01-17,"1950"
"297","Enero ",1,"18/01/1950","0","4.6",0,24,1950-01-18,"1950"
"298","Enero ",1,"19/01/1950","0","5.2",1.5,23,1950-01-19,"1950"
"299","Enero ",1,"20/01/1950","0","6.1",0,22,1950-01-20,"1950"
"300","Enero ",1,"21/01/1950","0","4.7",-1,22,1950-01-21,"1950"
"301","Enero ",1,"22/01/1950","0","4.6",-0.5,24,1950-01-22,"1950"
"302","Enero ",1,"23/01/1950","0","6",0,25,1950-01-23,"1950"
"303","Enero ",1,"24/01/1950","0","7.4",0,22.5,1950-01-24,"1950"
"304","Enero ",1,"25/01/1950","0","8",2,20.5,1950-01-25,"1950"
"305","Enero ",1,"26/01/1950","0","5.7",-1,23,1950-01-26,"1950"
"306","Enero ",1,"27/01/1950","0","6",0,20,1950-01-27,"1950"
"307","Enero ",1,"28/01/1950","0","10.7",0,24.5,1950-01-28,"1950"
"308","Enero ",1,"29/01/1950","0","8.5",6,25,1950-01-29,"1950"
"309","Enero ",1,"30/01/1950","0","6.1",6.5,23,1950-01-30,"1950"
"310","Enero ",1,"31/01/1950","0","8.5",7.5,22.5,1950-01-31,"1950"
"311","Enero ",1,"01/01/1951","0","2.6",-4.5,16,1951-01-01,"1951"
"312","Enero ",1,"02/01/1951","0","4.5",1,20,1951-01-02,"1951"
"313","Enero ",1,"03/01/1951","0","5.5",-5.5,25,1951-01-03,"1951"
"314","Enero ",1,"04/01/1951","0","5.3",-6,25,1951-01-04,"1951"
"315","Enero ",1,"05/01/1951","0","7.9",-5,17.5,1951-01-05,"1951"
"316","Enero ",1,"06/01/1951","0","4.9",-4,22.5,1951-01-06,"1951"
"317","Enero ",1,"07/01/1951","0","5.4",-0.5,20,1951-01-07,"1951"
"318","Enero ",1,"08/01/1951","0","2.2",-4,13,1951-01-08,"1951"
"319","Enero ",1,"09/01/1951","0","7.4",-3,19,1951-01-09,"1951"
"320","Enero ",1,"10/01/1951","0","3.2",-1,22.5,1951-01-10,"1951"
"321","Enero ",1,"11/01/1951","0","7",-1,21,1951-01-11,"1951"
"322","Enero ",1,"12/01/1951","0","3.2",0,11,1951-01-12,"1951"
"323","Enero ",1,"13/01/1951","0","5.4",1,13,1951-01-13,"1951"
"324","Enero ",1,"14/01/1951","0","3.9",-3,28,1951-01-14,"1951"
"325","Enero ",1,"15/01/1951","0","5.1",-12,20,1951-01-15,"1951"
"326","Enero ",1,"16/01/1951","0","5.8",-11.5,20,1951-01-16,"1951"
"327","Enero ",1,"17/01/1951","0","7",-9,24,1951-01-17,"1951"
"328","Enero ",1,"18/01/1951","0","5.3",-4,25,1951-01-18,"1951"
"329","Enero ",1,"19/01/1951","0","3.9",-5,23,1951-01-19,"1951"
"330","Enero ",1,"20/01/1951","0","4.4",-5,20.5,1951-01-20,"1951"
"331","Enero ",1,"21/01/1951","0","5.2",-2.5,24,1951-01-21,"1951"
"332","Enero ",1,"22/01/1951","0","6.7",-1,19,1951-01-22,"1951"
"333","Enero ",1,"23/01/1951","0","9.6",2.5,19,1951-01-23,"1951"
"334","Enero ",1,"24/01/1951","0","5.1",0,22,1951-01-24,"1951"
"335","Enero ",1,"25/01/1951","0","4.3",-1,22.5,1951-01-25,"1951"
"336","Enero ",1,"26/01/1951","0","8.7",-1,19,1951-01-26,"1951"
"337","Enero ",1,"27/01/1951","0","9.3",-1,25,1951-01-27,"1951"
"338","Enero ",1,"28/01/1951","0","7.8",6,17,1951-01-28,"1951"
"339","Enero ",1,"29/01/1951","0","10",6,18.5,1951-01-29,"1951"
"340","Enero ",1,"30/01/1951","0","11.2",4,13,1951-01-30,"1951"
"341","Enero ",1,"31/01/1951","0","10.7",2.5,20,1951-01-31,"1951"
"342","Enero ",1,"01/01/1952","0","7.8",2,23,1952-01-01,"1952"
"343","Enero ",1,"02/01/1952","0","7.1",-1,24,1952-01-02,"1952"
"344","Enero ",1,"03/01/1952","0","7.3",-1,17.5,1952-01-03,"1952"
"345","Enero ",1,"04/01/1952","0","6.7",0,26,1952-01-04,"1952"
"346","Enero ",1,"05/01/1952","0","5.5",4,14.5,1952-01-05,"1952"
"347","Enero ",1,"06/01/1952","0","4.2",3,22,1952-01-06,"1952"
"348","Enero ",1,"07/01/1952","0","7.2",2.5,18,1952-01-07,"1952"
"349","Enero ",1,"08/01/1952","0","8.2",3,23,1952-01-08,"1952"
"350","Enero ",1,"09/01/1952","0","4.2",1.5,23,1952-01-09,"1952"
"351","Enero ",1,"10/01/1952","0","3",0.5,16,1952-01-10,"1952"
"352","Enero ",1,"11/01/1952","0","6.8",2,22.5,1952-01-11,"1952"
"353","Enero ",1,"12/01/1952","0","5.3",2,17.5,1952-01-12,"1952"
"354","Enero ",1,"13/01/1952","0","6.8",2,17,1952-01-13,"1952"
"355","Enero ",1,"14/01/1952","0","5.8",7,20,1952-01-14,"1952"
"356","Enero ",1,"15/01/1952","0","6",5.5,20,1952-01-15,"1952"
"357","Enero ",1,"16/01/1952","0","7.7",5,23.5,1952-01-16,"1952"
"358","Enero ",1,"17/01/1952","0","8",2,23,1952-01-17,"1952"
"359","Enero ",1,"18/01/1952","0","7.1",2,19,1952-01-18,"1952"
"360","Enero ",1,"19/01/1952","0","6.9",2,21,1952-01-19,"1952"
"361","Enero ",1,"20/01/1952","0","7.9",1,16.5,1952-01-20,"1952"
"362","Enero ",1,"21/01/1952","0","5.9",3.5,20,1952-01-21,"1952"
"363","Enero ",1,"22/01/1952","0","5.4",4,22,1952-01-22,"1952"
"364","Enero ",1,"23/01/1952","0","4.2",2,20,1952-01-23,"1952"
"365","Enero ",1,"24/01/1952","0","5.4",0,22,1952-01-24,"1952"
"366","Enero ",1,"25/01/1952","0","8.5",2,18.5,1952-01-25,"1952"
"367","Enero ",1,"26/01/1952","0","9.2",3,24.5,1952-01-26,"1952"
"368","Enero ",1,"27/01/1952","0","7.3",2,19,1952-01-27,"1952"
"369","Enero ",1,"28/01/1952","0","5",1.5,17,1952-01-28,"1952"
"370","Enero ",1,"29/01/1952","0","5.3",-2.5,16,1952-01-29,"1952"
"371","Enero ",1,"30/01/1952","0","6.9",-2,20.5,1952-01-30,"1952"
"372","Enero ",1,"31/01/1952","0","4.7",1.5,20.5,1952-01-31,"1952"
"373","Enero ",1,"01/01/1953","0","6.9",-6.5,18,1953-01-01,"1953"
"374","Enero ",1,"02/01/1953","0","2.4",1,24,1953-01-02,"1953"
"375","Enero ",1,"03/01/1953","0","4.3",-4,17,1953-01-03,"1953"
"376","Enero ",1,"04/01/1953","0","3.3",-4,24,1953-01-04,"1953"
"377","Enero ",1,"05/01/1953","0","4.6",-6,15,1953-01-05,"1953"
"378","Enero ",1,"06/01/1953","0","4.4",5,10,1953-01-06,"1953"
"379","Enero ",1,"07/01/1953","0","3.5",7,19,1953-01-07,"1953"
"380","Enero ",1,"08/01/1953","0","5.4",1.5,24,1953-01-08,"1953"
"381","Enero ",1,"09/01/1953","0","4.2",-3,20,1953-01-09,"1953"
"382","Enero ",1,"10/01/1953","0","4.1",-3,21.5,1953-01-10,"1953"
"383","Enero ",1,"11/01/1953","0","5.5",-3,25,1953-01-11,"1953"
"384","Enero ",1,"12/01/1953","0","4.3",-3,23,1953-01-12,"1953"
"385","Enero ",1,"13/01/1953","0","3.8",-2.5,25,1953-01-13,"1953"
"386","Enero ",1,"14/01/1953","0","6.7",-2.5,24,1953-01-14,"1953"
"387","Enero ",1,"15/01/1953","0","6.9",-1.5,20,1953-01-15,"1953"
"388","Enero ",1,"16/01/1953","0","6.4",1,23,1953-01-16,"1953"
"389","Enero ",1,"17/01/1953","0","3.1",-5,23,1953-01-17,"1953"
"390","Enero ",1,"18/01/1953","0","5.9",-5,18,1953-01-18,"1953"
"391","Enero ",1,"19/01/1953","0","4.8",5,22,1953-01-19,"1953"
"392","Enero ",1,"20/01/1953","0","5.9",2.5,24,1953-01-20,"1953"
"393","Enero ",1,"21/01/1953","0","8.6",-2.5,14,1953-01-21,"1953"
"394","Enero ",1,"22/01/1953","0","7.2",-3,22,1953-01-22,"1953"
"395","Enero ",1,"23/01/1953","0","4",-4,21,1953-01-23,"1953"
"396","Enero ",1,"24/01/1953","0","4.1",-5,20,1953-01-24,"1953"
"397","Enero ",1,"25/01/1953","0","5",-6,23,1953-01-25,"1953"
"398","Enero ",1,"26/01/1953","0","4.7",-4,24,1953-01-26,"1953"
"399","Enero ",1,"27/01/1953","0","5.3",-2.5,27,1953-01-27,"1953"
"400","Enero ",1,"28/01/1953","0","5.4",-2,23,1953-01-28,"1953"
"401","Enero ",1,"29/01/1953","0","5.6",-1,17,1953-01-29,"1953"
"402","Enero ",1,"30/01/1953","0","6.6",0,19,1953-01-30,"1953"
"403","Enero ",1,"31/01/1953","0","4.3",4,21,1953-01-31,"1953"
"404","Enero ",1,"01/01/1954","0","2.4",-2.5,19,1954-01-01,"1954"
"405","Enero ",1,"02/01/1954","0","5",2,24,1954-01-02,"1954"
"406","Enero ",1,"03/01/1954","0","6.9",2,24.5,1954-01-03,"1954"
"407","Enero ",1,"04/01/1954","0","5.2",1,24.5,1954-01-04,"1954"
"408","Enero ",1,"05/01/1954","0","2.3",1.5,21,1954-01-05,"1954"
"409","Enero ",1,"06/01/1954","0","4.3",1,22,1954-01-06,"1954"
"410","Enero ",1,"07/01/1954","0","6",1,22,1954-01-07,"1954"
"411","Enero ",1,"08/01/1954","0","3.8",2,22.5,1954-01-08,"1954"
"412","Enero ",1,"09/01/1954","0","6.7",4,19,1954-01-09,"1954"
"413","Enero ",1,"10/01/1954","0","4.4",1,22,1954-01-10,"1954"
"414","Enero ",1,"11/01/1954","0","5.5",-1,19,1954-01-11,"1954"
"415","Enero ",1,"12/01/1954","0","6.3",0,21,1954-01-12,"1954"
"416","Enero ",1,"13/01/1954","0","7.4",2,20,1954-01-13,"1954"
"417","Enero ",1,"14/01/1954","0","9.2",6,17.5,1954-01-14,"1954"
"418","Enero ",1,"15/01/1954","0","11.8",8,22,1954-01-15,"1954"
"419","Enero ",1,"16/01/1954","0","7",-1,22,1954-01-16,"1954"
"420","Enero ",1,"17/01/1954","0","5.3",0,23,1954-01-17,"1954"
"421","Enero ",1,"18/01/1954","0","7.3",1,23.5,1954-01-18,"1954"
"422","Enero ",1,"19/01/1954","0","8.1",6.5,21,1954-01-19,"1954"
"423","Enero ",1,"20/01/1954","0","6.6",3,22.5,1954-01-20,"1954"
"424","Enero ",1,"21/01/1954","0","5.9",5,25,1954-01-21,"1954"
"425","Enero ",1,"22/01/1954","0","7.1",0,23,1954-01-22,"1954"
"426","Enero ",1,"23/01/1954","0","8.2",5,25,1954-01-23,"1954"
"427","Enero ",1,"24/01/1954","0","6.2",7,22.5,1954-01-24,"1954"
"428","Enero ",1,"25/01/1954","0","5.1",10,22.5,1954-01-25,"1954"
"429","Enero ",1,"26/01/1954","0","5.9",5,24,1954-01-26,"1954"
"430","Enero ",1,"27/01/1954","0","5.1",3,24,1954-01-27,"1954"
"431","Enero ",1,"28/01/1954","0","4.6",3.5,23,1954-01-28,"1954"
"432","Enero ",1,"29/01/1954","0","5.7",3,24,1954-01-29,"1954"
"433","Enero ",1,"30/01/1954","0","7.1",2,24,1954-01-30,"1954"
"434","Enero ",1,"31/01/1954","0","6",3,22.5,1954-01-31,"1954"
"435","Enero ",1,"01/01/1955","0","3.6",6,18,1955-01-01,"1955"
"436","Enero ",1,"02/01/1955","0","4.7",5,21,1955-01-02,"1955"
"437","Enero ",1,"03/01/1955","0","5.1",6,19,1955-01-03,"1955"
"438","Enero ",1,"04/01/1955","0","6.5",6.5,20,1955-01-04,"1955"
"439","Enero ",1,"05/01/1955","0","5",7.5,22.5,1955-01-05,"1955"
"440","Enero ",1,"06/01/1955","0","6.7",4,22,1955-01-06,"1955"
"441","Enero ",1,"07/01/1955","0","5.2",4,20,1955-01-07,"1955"
"442","Enero ",1,"08/01/1955","0","2.5",5,13.5,1955-01-08,"1955"
"443","Enero ",1,"09/01/1955","0","11.1",6,17,1955-01-09,"1955"
"444","Enero ",1,"10/01/1955","0","2.3",-3,20.5,1955-01-10,"1955"
"445","Enero ",1,"11/01/1955","0","0.8",-2.5,16,1955-01-11,"1955"
"446","Enero ",1,"12/01/1955","0","1.7",7,16,1955-01-12,"1955"
"447","Enero ",1,"13/01/1955","0","6",7,20,1955-01-13,"1955"
"448","Enero ",1,"14/01/1955","0","4",8,18,1955-01-14,"1955"
"449","Enero ",1,"15/01/1955","0","5.1",7,23,1955-01-15,"1955"
"450","Enero ",1,"16/01/1955","0","6.1",2,21,1955-01-16,"1955"
"451","Enero ",1,"17/01/1955","0","8.8",0,19,1955-01-17,"1955"
"452","Enero ",1,"18/01/1955","0","6.5",-5.5,18,1955-01-18,"1955"
"453","Enero ",1,"19/01/1955","0","6.1",-5.5,22.5,1955-01-19,"1955"
"454","Enero ",1,"20/01/1955","0","5.9",-5,18,1955-01-20,"1955"
"455","Enero ",1,"21/01/1955","0","8",1,21.5,1955-01-21,"1955"
"456","Enero ",1,"22/01/1955","0","6.9",1,16,1955-01-22,"1955"
"457","Enero ",1,"23/01/1955","0","4.8",-9.5,15,1955-01-23,"1955"
"458","Enero ",1,"24/01/1955","0","4.6",-8.5,14,1955-01-24,"1955"
"459","Enero ",1,"25/01/1955","0","4.1",-8.5,20,1955-01-25,"1955"
"460","Enero ",1,"26/01/1955","0","6.8",-7,23,1955-01-26,"1955"
"461","Enero ",1,"27/01/1955","0","7.2",-5,20,1955-01-27,"1955"
"462","Enero ",1,"28/01/1955","0","5.4",-3,18,1955-01-28,"1955"
"463","Enero ",1,"29/01/1955","0","2.5",-5.5,20,1955-01-29,"1955"
"464","Enero ",1,"30/01/1955","0","7",-3,22,1955-01-30,"1955"
"465","Enero ",1,"31/01/1955","0","7.4",4,21,1955-01-31,"1955"
"466","Enero ",1,"01/01/1956","0","4",-4,23,1956-01-01,"1956"
"467","Enero ",1,"02/01/1956","0","3.4",-4,22,1956-01-02,"1956"
"468","Enero ",1,"03/01/1956","0","3.8",-4,19,1956-01-03,"1956"
"469","Enero ",1,"04/01/1956","0","4.7",-3.5,20,1956-01-04,"1956"
"470","Enero ",1,"05/01/1956","0","3.4",-5,21,1956-01-05,"1956"
"471","Enero ",1,"06/01/1956","0","2.3",-4,22.5,1956-01-06,"1956"
"472","Enero ",1,"07/01/1956","0","4.9",-4,22,1956-01-07,"1956"
"473","Enero ",1,"08/01/1956","0","2.9",-5,22,1956-01-08,"1956"
"474","Enero ",1,"09/01/1956","0","4.8",-5,21,1956-01-09,"1956"
"475","Enero ",1,"10/01/1956","0","4.8",-5,19,1956-01-10,"1956"
"476","Enero ",1,"11/01/1956","0","2.9",-7,17,1956-01-11,"1956"
"477","Enero ",1,"12/01/1956","0","1.4",-7,17,1956-01-12,"1956"
"478","Enero ",1,"13/01/1956","0","4.5",-7.5,18,1956-01-13,"1956"
"479","Enero ",1,"14/01/1956","0","5.8",-8,22,1956-01-14,"1956"
"480","Enero ",1,"15/01/1956","0","4.8",-7,23,1956-01-15,"1956"
"481","Enero ",1,"16/01/1956","0","4.7",-6,21,1956-01-16,"1956"
"482","Enero ",1,"17/01/1956","0","4.9",-1,17,1956-01-17,"1956"
"483","Enero ",1,"18/01/1956","0","6.5",-4,22,1956-01-18,"1956"
"484","Enero ",1,"19/01/1956","0","3.2",0,20,1956-01-19,"1956"
"485","Enero ",1,"20/01/1956","0","4.7",-2,20,1956-01-20,"1956"
"486","Enero ",1,"21/01/1956","0","6.5",-5,19,1956-01-21,"1956"
"487","Enero ",1,"22/01/1956","0","8.9",-5,18,1956-01-22,"1956"
"488","Enero ",1,"23/01/1956","0","5",-4,23,1956-01-23,"1956"
"489","Enero ",1,"24/01/1956","0","5.8",-3,24,1956-01-24,"1956"
"490","Enero ",1,"25/01/1956","0","5.3",-2,23,1956-01-25,"1956"
"491","Enero ",1,"26/01/1956","0","3.6",-2,24.5,1956-01-26,"1956"
"492","Enero ",1,"27/01/1956","0","7.1",-2,24,1956-01-27,"1956"
"493","Enero ",1,"28/01/1956","0","7.4",1,22.5,1956-01-28,"1956"
"494","Enero ",1,"29/01/1956","0","8.1",-2,24.5,1956-01-29,"1956"
"495","Enero ",1,"30/01/1956","0","4.9",-2.5,24,1956-01-30,"1956"
"496","Enero ",1,"31/01/1956","0","7.5",-2,24,1956-01-31,"1956"
"497","Enero ",1,"01/01/1957","0","8.9",5,24,1957-01-01,"1957"
"498","Enero ",1,"02/01/1957","0","5.9",4,24,1957-01-02,"1957"
"499","Enero ",1,"03/01/1957","0","3",4.5,24,1957-01-03,"1957"
"500","Enero ",1,"04/01/1957","0","3.7",5,25,1957-01-04,"1957"
"501","Enero ",1,"05/01/1957","0","3",4.5,23,1957-01-05,"1957"
"502","Enero ",1,"06/01/1957","0","5.7",4,23.5,1957-01-06,"1957"
"503","Enero ",1,"07/01/1957","0","6.5",2.5,24.5,1957-01-07,"1957"
"504","Enero ",1,"08/01/1957","0","4.9",1.5,26,1957-01-08,"1957"
"505","Enero ",1,"09/01/1957","0","3.7",3,25.5,1957-01-09,"1957"
"506","Enero ",1,"10/01/1957","0","6.7",2,25,1957-01-10,"1957"
"507","Enero ",1,"11/01/1957","0","2.6",0.5,25.5,1957-01-11,"1957"
"508","Enero ",1,"12/01/1957","0","5.4",1,24,1957-01-12,"1957"
"509","Enero ",1,"13/01/1957","0","2.5",0,23,1957-01-13,"1957"
"510","Enero ",1,"14/01/1957","0","5.6",3,25,1957-01-14,"1957"
"511","Enero ",1,"15/01/1957","0","4.8",1,25.5,1957-01-15,"1957"
"512","Enero ",1,"16/01/1957","0","4.8",3,26,1957-01-16,"1957"
"513","Enero ",1,"17/01/1957","0","5.5",4,26,1957-01-17,"1957"
"514","Enero ",1,"18/01/1957","0","3.3",-3,24,1957-01-18,"1957"
"515","Enero ",1,"19/01/1957","0","1.9",-3,20,1957-01-19,"1957"
"516","Enero ",1,"20/01/1957","0","6.8",0,21,1957-01-20,"1957"
"517","Enero ",1,"21/01/1957","0","1",2,20,1957-01-21,"1957"
"518","Enero ",1,"22/01/1957","0","2.5",7,20,1957-01-22,"1957"
"519","Enero ",1,"23/01/1957","0","3.8",8,21,1957-01-23,"1957"
"520","Enero ",1,"24/01/1957","0","4",5,21,1957-01-24,"1957"
"521","Enero ",1,"25/01/1957","0","5.7",6,24,1957-01-25,"1957"
"522","Enero ",1,"26/01/1957","0","3.9",6,25,1957-01-26,"1957"
"523","Enero ",1,"27/01/1957","0","4.9",5,25,1957-01-27,"1957"
"524","Enero ",1,"28/01/1957","0","4.8",5,24,1957-01-28,"1957"
"525","Enero ",1,"29/01/1957","0","5.6",8,23,1957-01-29,"1957"
"526","Enero ",1,"30/01/1957","0","5.4",7,25,1957-01-30,"1957"
"527","Enero ",1,"31/01/1957","0","7.7",7,26.5,1957-01-31,"1957"
"528","Enero ",1,"01/01/1958","2.5","2.5",-3,6,1958-01-01,"1958"
"529","Enero ",1,"02/01/1958","0","3.9",-2,19,1958-01-02,"1958"
"530","Enero ",1,"03/01/1958","0","3.7",1,18,1958-01-03,"1958"
"531","Enero ",1,"04/01/1958","0","2",2,19.5,1958-01-04,"1958"
"532","Enero ",1,"05/01/1958","1.5","3.2",-1,20.5,1958-01-05,"1958"
"533","Enero ",1,"06/01/1958","10.7","0.5",2.5,5,1958-01-06,"1958"
"534","Enero ",1,"07/01/1958","0","3.4",0,8,1958-01-07,"1958"
"535","Enero ",1,"08/01/1958","0","1.4",-5,14,1958-01-08,"1958"
"536","Enero ",1,"09/01/1958","0","1",-5,19.5,1958-01-09,"1958"
"537","Enero ",1,"10/01/1958","0","4",2,20.5,1958-01-10,"1958"
"538","Enero ",1,"11/01/1958","0","5",2.5,18,1958-01-11,"1958"
"539","Enero ",1,"12/01/1958","0","3.8",-2,24,1958-01-12,"1958"
"540","Enero ",1,"13/01/1958","0","5.3",-4,25,1958-01-13,"1958"
"541","Enero ",1,"14/01/1958","0","2.5",-2,25,1958-01-14,"1958"
"542","Enero ",1,"15/01/1958","0","2.2",-1,16,1958-01-15,"1958"
"543","Enero ",1,"16/01/1958","1.5","1.2",-1,10,1958-01-16,"1958"
"544","Enero ",1,"17/01/1958","10.5","5.5",0,10,1958-01-17,"1958"
"545","Enero ",1,"18/01/1958","0","3",2,13,1958-01-18,"1958"
"546","Enero ",1,"19/01/1958","0","2.1",-1,17,1958-01-19,"1958"
"547","Enero ",1,"20/01/1958","0","5.4",0,20,1958-01-20,"1958"
"548","Enero ",1,"21/01/1958","0","6.3",2,21,1958-01-21,"1958"
"549","Enero ",1,"22/01/1958","0","5.1",2,17,1958-01-22,"1958"
"550","Enero ",1,"23/01/1958","0","5.4",2,15,1958-01-23,"1958"
"551","Enero ",1,"24/01/1958","0","2.6",-5,20,1958-01-24,"1958"
"552","Enero ",1,"25/01/1958","0","5.1",-4,26,1958-01-25,"1958"
"553","Enero ",1,"26/01/1958","0","5",-1,25,1958-01-26,"1958"
"554","Enero ",1,"27/01/1958","0","7",4,23,1958-01-27,"1958"
"555","Enero ",1,"28/01/1958","0","4.6",2,21,1958-01-28,"1958"
"556","Enero ",1,"29/01/1958","0","2.7",-5,21,1958-01-29,"1958"
"557","Enero ",1,"30/01/1958","0","5",-4.5,25,1958-01-30,"1958"
"558","Enero ",1,"31/01/1958","0","4.6",0,27,1958-01-31,"1958"
"559","Enero ",1,"01/01/1959","0","4",-8,15,1959-01-01,"1959"
"560","Enero ",1,"02/01/1959","0","5.6",-6,23,1959-01-02,"1959"
"561","Enero ",1,"03/01/1959","0","2.5",-5,22,1959-01-03,"1959"
"562","Enero ",1,"04/01/1959","0","2.9",-2,21,1959-01-04,"1959"
"563","Enero ",1,"05/01/1959","2","1",4,15,1959-01-05,"1959"
"564","Enero ",1,"06/01/1959","0","4.2",3,21.5,1959-01-06,"1959"
"565","Enero ",1,"07/01/1959","0","4.4",2,22,1959-01-07,"1959"
"566","Enero ",1,"08/01/1959","0","5.2",0,21,1959-01-08,"1959"
"567","Enero ",1,"09/01/1959","0","1.8",0,29,1959-01-09,"1959"
"568","Enero ",1,"10/01/1959","0","3.7",-1,24,1959-01-10,"1959"
"569","Enero ",1,"11/01/1959","0","2.8",-1,22,1959-01-11,"1959"
"570","Enero ",1,"12/01/1959","0","3.2",-2,22,1959-01-12,"1959"
"571","Enero ",1,"13/01/1959","0","2.8",1,20,1959-01-13,"1959"
"572","Enero ",1,"14/01/1959","0","5.3",-1,22,1959-01-14,"1959"
"573","Enero ",1,"15/01/1959","0","Nulo",-1,23,1959-01-15,"1959"
"574","Enero ",1,"16/01/1959","0","Nulo",-4.5,25,1959-01-16,"1959"
"575","Enero ",1,"17/01/1959","0","Nulo",0,26.5,1959-01-17,"1959"
"576","Enero ",1,"18/01/1959","0","Nulo",-1,27,1959-01-18,"1959"
"577","Enero ",1,"19/01/1959","0","Nulo",2,24.5,1959-01-19,"1959"
"578","Enero ",1,"20/01/1959","0","Nulo",9,16,1959-01-20,"1959"
"579","Enero ",1,"21/01/1959","0","10.3",2.5,22,1959-01-21,"1959"
"580","Enero ",1,"22/01/1959","0","5.5",1,25,1959-01-22,"1959"
"581","Enero ",1,"23/01/1959","0","5.7",-1,25,1959-01-23,"1959"
"582","Enero ",1,"24/01/1959","0","5",3.3,25,1959-01-24,"1959"
"583","Enero ",1,"25/01/1959","0","6.3",-1.5,24.5,1959-01-25,"1959"
"584","Enero ",1,"26/01/1959","0","5.3",1,26,1959-01-26,"1959"
"585","Enero ",1,"27/01/1959","0","3.9",1.5,24.5,1959-01-27,"1959"
"586","Enero ",1,"28/01/1959","0","9.1",1.5,21,1959-01-28,"1959"
"587","Enero ",1,"29/01/1959","0","4.1",7,18,1959-01-29,"1959"
"588","Enero ",1,"30/01/1959","0","5",5,21,1959-01-30,"1959"
"589","Enero ",1,"31/01/1959","0","1.5",5,20,1959-01-31,"1959"
"590","Enero ",1,"01/01/1960","0","4",3,26,1960-01-01,"1960"
"591","Enero ",1,"02/01/1960","0","9",4,27,1960-01-02,"1960"
"592","Enero ",1,"03/01/1960","0","8.6",5,22,1960-01-03,"1960"
"593","Enero ",1,"04/01/1960","0","7.1",1,21,1960-01-04,"1960"
"594","Enero ",1,"05/01/1960","0","4.1",5,18,1960-01-05,"1960"
"595","Enero ",1,"06/01/1960","0","3.8",3,22,1960-01-06,"1960"
"596","Enero ",1,"07/01/1960","0","2.5",1,18,1960-01-07,"1960"
"597","Enero ",1,"08/01/1960","0","1.5",0,21,1960-01-08,"1960"
"598","Enero ",1,"09/01/1960","0","4.7",5,22,1960-01-09,"1960"
"599","Enero ",1,"10/01/1960","0","6.1",4,23,1960-01-10,"1960"
"600","Enero ",1,"11/01/1960","0","2.8",2,20,1960-01-11,"1960"
"601","Enero ",1,"12/01/1960","0","4.1",5,20,1960-01-12,"1960"
"602","Enero ",1,"13/01/1960","2.5","0.1",5,15,1960-01-13,"1960"
"603","Enero ",1,"14/01/1960","0","7.6",3,21,1960-01-14,"1960"
"604","Enero ",1,"15/01/1960","0","5.4",3,19,1960-01-15,"1960"
"605","Enero ",1,"16/01/1960","0","5.9",4,22,1960-01-16,"1960"
"606","Enero ",1,"17/01/1960","0","7",-4,20,1960-01-17,"1960"
"607","Enero ",1,"18/01/1960","0","1.5",-6,16,1960-01-18,"1960"
"608","Enero ",1,"19/01/1960","0","2.6",-4.5,16,1960-01-19,"1960"
"609","Enero ",1,"20/01/1960","0","3.3",1,17,1960-01-20,"1960"
"610","Enero ",1,"21/01/1960","0","2",-1,19,1960-01-21,"1960"
"611","Enero ",1,"22/01/1960","0","4.1",1,22,1960-01-22,"1960"
"612","Enero ",1,"23/01/1960","0","6.5",1,20,1960-01-23,"1960"
"613","Enero ",1,"24/01/1960","0","4.1",-1,22,1960-01-24,"1960"
"614","Enero ",1,"25/01/1960","0","9.5",-1,32,1960-01-25,"1960"
"615","Enero ",1,"26/01/1960","0","11.3",1,25.5,1960-01-26,"1960"
"616","Enero ",1,"27/01/1960","0","6.2",-0.5,26,1960-01-27,"1960"
"617","Enero ",1,"28/01/1960","0","4.8",0,24,1960-01-28,"1960"
"618","Enero ",1,"29/01/1960","0","4.6",1,18,1960-01-29,"1960"
"619","Enero ",1,"30/01/1960","0","7.6",-1,16,1960-01-30,"1960"
"620","Enero ",1,"31/01/1960","0","Nulo",-3,12,1960-01-31,"1960"
"621","Enero ",1,"01/01/1972","0","Nulo   N",NA,NA,1972-01-01,"1972"
"622","Enero ",1,"02/01/1972","0","Nulo   N",NA,NA,1972-01-02,"1972"
"623","Enero ",1,"03/01/1972","7.5","Nulo   N",NA,NA,1972-01-03,"1972"
"624","Enero ",1,"04/01/1972","0","Nulo   N",NA,NA,1972-01-04,"1972"
"625","Enero ",1,"05/01/1972","0","Nulo   N",NA,NA,1972-01-05,"1972"
"626","Enero ",1,"06/01/1972","0","Nulo   N",NA,NA,1972-01-06,"1972"
"627","Enero ",1,"07/01/1972","0","Nulo   N",NA,NA,1972-01-07,"1972"
"628","Enero ",1,"08/01/1972","0","Nulo   N",NA,NA,1972-01-08,"1972"
"629","Enero ",1,"09/01/1972","0","Nulo   N",NA,NA,1972-01-09,"1972"
"630","Enero ",1,"10/01/1972","0","Nulo   N",NA,NA,1972-01-10,"1972"
"631","Enero ",1,"11/01/1972","0","Nulo   N",NA,NA,1972-01-11,"1972"
"632","Enero ",1,"12/01/1972","0","Nulo   N",NA,NA,1972-01-12,"1972"
"633","Enero ",1,"13/01/1972","0","Nulo   N",NA,NA,1972-01-13,"1972"
"634","Enero ",1,"14/01/1972","0","Nulo   N",NA,NA,1972-01-14,"1972"
"635","Enero ",1,"15/01/1972","0","Nulo   N",NA,NA,1972-01-15,"1972"
"636","Enero ",1,"16/01/1972","0","Nulo   N",NA,NA,1972-01-16,"1972"
"637","Enero ",1,"17/01/1972","0","Nulo   N",NA,NA,1972-01-17,"1972"
"638","Enero ",1,"18/01/1972","0","Nulo   N",NA,NA,1972-01-18,"1972"
"639","Enero ",1,"19/01/1972","0","Nulo   N",NA,NA,1972-01-19,"1972"
"640","Enero ",1,"20/01/1972","0","Nulo   N",NA,NA,1972-01-20,"1972"
"641","Enero ",1,"21/01/1972","0","Nulo   N",NA,NA,1972-01-21,"1972"
"642","Enero ",1,"22/01/1972","0","Nulo   N",NA,NA,1972-01-22,"1972"
"643","Enero ",1,"23/01/1972","0","Nulo   N",NA,NA,1972-01-23,"1972"
"644","Enero ",1,"24/01/1972","0","Nulo   N",NA,NA,1972-01-24,"1972"
"645","Enero ",1,"25/01/1972","0","Nulo   N",NA,NA,1972-01-25,"1972"
"646","Enero ",1,"26/01/1972","6","Nulo   N",NA,NA,1972-01-26,"1972"
"647","Enero ",1,"27/01/1972","0","Nulo   N",NA,NA,1972-01-27,"1972"
"648","Enero ",1,"28/01/1972","0","Nulo   N",NA,NA,1972-01-28,"1972"
"649","Enero ",1,"29/01/1972","0","Nulo   N",NA,NA,1972-01-29,"1972"
"650","Enero ",1,"30/01/1972","0","Nulo   N",NA,NA,1972-01-30,"1972"
"651","Enero ",1,"31/01/1972","0","Nulo   N",NA,NA,1972-01-31,"1972"
"652","Enero ",1,"01/01/1973","0","5.5",7,20,1973-01-01,"1973"
"653","Enero ",1,"02/01/1973","0","6.6",5,18,1973-01-02,"1973"
"654","Enero ",1,"03/01/1973","0","9",4.5,23.5,1973-01-03,"1973"
"655","Enero ",1,"04/01/1973","0","5.6",5,25.5,1973-01-04,"1973"
"656","Enero ",1,"05/01/1973","0","2.9",5.5,24,1973-01-05,"1973"
"657","Enero ",1,"06/01/1973","0","3",9,20,1973-01-06,"1973"
"658","Enero ",1,"07/01/1973","0","6.8",8.5,21,1973-01-07,"1973"
"659","Enero ",1,"08/01/1973","20","4",7.5,20,1973-01-08,"1973"
"660","Enero ",1,"09/01/1973","3.7","3.9",7,17,1973-01-09,"1973"
"661","Enero ",1,"10/01/1973","0","3.2",8,18,1973-01-10,"1973"
"662","Enero ",1,"11/01/1973","0","6.2",4,16,1973-01-11,"1973"
"663","Enero ",1,"12/01/1973","0","0.3",-1,14,1973-01-12,"1973"
"664","Enero ",1,"13/01/1973","0","8.2",-1,19,1973-01-13,"1973"
"665","Enero ",1,"14/01/1973","0","2.3",2,21,1973-01-14,"1973"
"666","Enero ",1,"15/01/1973","0","0.5",3,22,1973-01-15,"1973"
"667","Enero ",1,"16/01/1973","0","5",6,23,1973-01-16,"1973"
"668","Enero ",1,"17/01/1973","0","5.9",5,25,1973-01-17,"1973"
"669","Enero ",1,"18/01/1973","0","3.5",4.5,22,1973-01-18,"1973"
"670","Enero ",1,"19/01/1973","0","4.4",5.5,19.5,1973-01-19,"1973"
"671","Enero ",1,"20/01/1973","0","3.6",2.5,20,1973-01-20,"1973"
"672","Enero ",1,"21/01/1973","0","3.5",3,22,1973-01-21,"1973"
"673","Enero ",1,"22/01/1973","0","3",4,21,1973-01-22,"1973"
"674","Enero ",1,"23/01/1973","0","2",4,20,1973-01-23,"1973"
"675","Enero ",1,"24/01/1973","0","3.3",-1,14,1973-01-24,"1973"
"676","Enero ",1,"25/01/1973","0","4.4",-3,17,1973-01-25,"1973"
"677","Enero ",1,"26/01/1973","0","4.4",-1,22,1973-01-26,"1973"
"678","Enero ",1,"27/01/1973","0","5.2",-3,23,1973-01-27,"1973"
"679","Enero ",1,"28/01/1973","0","7.5",-3,24,1973-01-28,"1973"
"680","Enero ",1,"29/01/1973","0","4",-3,14,1973-01-29,"1973"
"681","Enero ",1,"30/01/1973","0","8",-1,20,1973-01-30,"1973"
"682","Enero ",1,"31/01/1973","0","7.8",2,22,1973-01-31,"1973"
"683","Enero ",1,"01/01/1974","0","9.2",6,25,1974-01-01,"1974"
"684","Enero ",1,"02/01/1974","0","6.9",4,21,1974-01-02,"1974"
"685","Enero ",1,"03/01/1974","0","4.6",4,22,1974-01-03,"1974"
"686","Enero ",1,"04/01/1974","0","6.4",4,22,1974-01-04,"1974"
"687","Enero ",1,"05/01/1974","0","3.3",6,22,1974-01-05,"1974"
"688","Enero ",1,"06/01/1974","0","6.3",6,24,1974-01-06,"1974"
"689","Enero ",1,"07/01/1974","0","7.1",8,23,1974-01-07,"1974"
"690","Enero ",1,"08/01/1974","0","5.8",9,22,1974-01-08,"1974"
"691","Enero ",1,"09/01/1974","0","3.2",10,21,1974-01-09,"1974"
"692","Enero ",1,"10/01/1974","0","5.6",2,24,1974-01-10,"1974"
"693","Enero ",1,"11/01/1974","0","6.7",5,25,1974-01-11,"1974"
"694","Enero ",1,"12/01/1974","0","7.1",6,28,1974-01-12,"1974"
"695","Enero ",1,"13/01/1974","0","6.3",8,27,1974-01-13,"1974"
"696","Enero ",1,"14/01/1974","0","6.9",6,27,1974-01-14,"1974"
"697","Enero ",1,"15/01/1974","0","8.8",8,25,1974-01-15,"1974"
"698","Enero ",1,"16/01/1974","0","3.7",6,26,1974-01-16,"1974"
"699","Enero ",1,"17/01/1974","0","3.7",6,26,1974-01-17,"1974"
"700","Enero ",1,"18/01/1974","0","9.1",8,27,1974-01-18,"1974"
"701","Enero ",1,"19/01/1974","0","5.2",5,27,1974-01-19,"1974"
"702","Enero ",1,"20/01/1974","0","6.2",6,27,1974-01-20,"1974"
"703","Enero ",1,"21/01/1974","0","4.1",5,26,1974-01-21,"1974"
"704","Enero ",1,"22/01/1974","0","5.7",8,24,1974-01-22,"1974"
"705","Enero ",1,"23/01/1974","0","7.8",6,23,1974-01-23,"1974"
"706","Enero ",1,"24/01/1974","0","7.9",6,19,1974-01-24,"1974"
"707","Enero ",1,"25/01/1974","6","2.7",6,27,1974-01-25,"1974"
"708","Enero ",1,"26/01/1974","0","8.8",2,20,1974-01-26,"1974"
"709","Enero ",1,"27/01/1974","0","4.9",3,22,1974-01-27,"1974"
"710","Enero ",1,"28/01/1974","0","5.5",1,24,1974-01-28,"1974"
"711","Enero ",1,"29/01/1974","0","8.6",3,26,1974-01-29,"1974"
"712","Enero ",1,"30/01/1974","0","7.5",4,24,1974-01-30,"1974"
"713","Enero ",1,"31/01/1974","0","4.7",5,24,1974-01-31,"1974"
"714","Enero ",1,"01/01/1975","0","4.8",5,22,1975-01-01,"1975"
"715","Enero ",1,"02/01/1975","0","3",5,22,1975-01-02,"1975"
"716","Enero ",1,"03/01/1975","0","7.9",6,20,1975-01-03,"1975"
"717","Enero ",1,"04/01/1975","0","3.1",1,20,1975-01-04,"1975"
"718","Enero ",1,"05/01/1975","0","3.3",2,21,1975-01-05,"1975"
"719","Enero ",1,"06/01/1975","0","3.4",6,19,1975-01-06,"1975"
"720","Enero ",1,"07/01/1975","0","2.1",7,20,1975-01-07,"1975"
"721","Enero ",1,"08/01/1975","0","4.6",6,23,1975-01-08,"1975"
"722","Enero ",1,"09/01/1975","0","4.2",7,17,1975-01-09,"1975"
"723","Enero ",1,"10/01/1975","0","5.2",2,16,1975-01-10,"1975"
"724","Enero ",1,"11/01/1975","0","5.2",2,20,1975-01-11,"1975"
"725","Enero ",1,"12/01/1975","0","5.1",1.5,22,1975-01-12,"1975"
"726","Enero ",1,"13/01/1975","0","1.8",-3,18,1975-01-13,"1975"
"727","Enero ",1,"14/01/1975","0","5.8",-2,23,1975-01-14,"1975"
"728","Enero ",1,"15/01/1975","0","4.1",-1,23,1975-01-15,"1975"
"729","Enero ",1,"16/01/1975","0","4.1",2,23,1975-01-16,"1975"
"730","Enero ",1,"17/01/1975","0","3.5",2,25,1975-01-17,"1975"
"731","Enero ",1,"18/01/1975","0","2",4,21,1975-01-18,"1975"
"732","Enero ",1,"19/01/1975","22","3.3",3,18,1975-01-19,"1975"
"733","Enero ",1,"20/01/1975","0","2.1",2,18,1975-01-20,"1975"
"734","Enero ",1,"21/01/1975","0","3.2",-2,19,1975-01-21,"1975"
"735","Enero ",1,"22/01/1975","0","4.1",4,21,1975-01-22,"1975"
"736","Enero ",1,"23/01/1975","0","3.2",1,22,1975-01-23,"1975"
"737","Enero ",1,"24/01/1975","0","8.4",3,23,1975-01-24,"1975"
"738","Enero ",1,"25/01/1975","0","4.3",2,22,1975-01-25,"1975"
"739","Enero ",1,"26/01/1975","0","4.3",2.5,28,1975-01-26,"1975"
"740","Enero ",1,"27/01/1975","0","5.1",3,27,1975-01-27,"1975"
"741","Enero ",1,"28/01/1975","0","7.9",10,27,1975-01-28,"1975"
"742","Enero ",1,"29/01/1975","0","5",9,26,1975-01-29,"1975"
"743","Enero ",1,"30/01/1975","0","4.4",11,25,1975-01-30,"1975"
"744","Enero ",1,"31/01/1975","0","4",11,23,1975-01-31,"1975"
"745","Enero ",1,"01/01/1976","0","Nulo",3,22,1976-01-01,"1976"
"746","Enero ",1,"02/01/1976","0","Nulo",-2,20,1976-01-02,"1976"
"747","Enero ",1,"03/01/1976","0","Nulo",-3,18,1976-01-03,"1976"
"748","Enero ",1,"04/01/1976","0","Nulo",-3,21,1976-01-04,"1976"
"749","Enero ",1,"05/01/1976","0","Nulo",2,23,1976-01-05,"1976"
"750","Enero ",1,"06/01/1976","0","Nulo",4,24,1976-01-06,"1976"
"751","Enero ",1,"07/01/1976","0","Nulo",5,24,1976-01-07,"1976"
"752","Enero ",1,"08/01/1976","0","Nulo",4,23,1976-01-08,"1976"
"753","Enero ",1,"09/01/1976","0","Nulo",1,26,1976-01-09,"1976"
"754","Enero ",1,"10/01/1976","0","Nulo",4,25,1976-01-10,"1976"
"755","Enero ",1,"11/01/1976","0","Nulo",5,24,1976-01-11,"1976"
"756","Enero ",1,"12/01/1976","0","Nulo",3,26,1976-01-12,"1976"
"757","Enero ",1,"13/01/1976","0","Nulo",9,25,1976-01-13,"1976"
"758","Enero ",1,"14/01/1976","0","Nulo",7,26,1976-01-14,"1976"
"759","Enero ",1,"15/01/1976","0","Nulo",6,28,1976-01-15,"1976"
"760","Enero ",1,"16/01/1976","0","Nulo",8,21,1976-01-16,"1976"
"761","Enero ",1,"17/01/1976","0","Nulo",3,26,1976-01-17,"1976"
"762","Enero ",1,"18/01/1976","0","Nulo",3,22,1976-01-18,"1976"
"763","Enero ",1,"19/01/1976","0","Nulo",-2,26,1976-01-19,"1976"
"764","Enero ",1,"20/01/1976","0","Nulo",3,22,1976-01-20,"1976"
"765","Enero ",1,"21/01/1976","0","Nulo",3,22,1976-01-21,"1976"
"766","Enero ",1,"22/01/1976","0","Nulo",2,20,1976-01-22,"1976"
"767","Enero ",1,"23/01/1976","0","Nulo",3,21,1976-01-23,"1976"
"768","Enero ",1,"24/01/1976","0","Nulo",7,23,1976-01-24,"1976"
"769","Enero ",1,"25/01/1976","0","Nulo",5,23,1976-01-25,"1976"
"770","Enero ",1,"26/01/1976","0","Nulo",2,19,1976-01-26,"1976"
"771","Enero ",1,"27/01/1976","0","Nulo",1,13,1976-01-27,"1976"
"772","Enero ",1,"28/01/1976","0","Nulo",3,24,1976-01-28,"1976"
"773","Enero ",1,"29/01/1976","0","Nulo",5,22,1976-01-29,"1976"
"774","Enero ",1,"30/01/1976","0","Nulo",7,22,1976-01-30,"1976"
"775","Enero ",1,"31/01/1976","0","Nulo",-4,23,1976-01-31,"1976"
"776","Enero ",1,"01/01/1977","20","0.4",-1,18,1977-01-01,"1977"
"777","Enero ",1,"02/01/1977","0","5.6",-2,17,1977-01-02,"1977"
"778","Enero ",1,"03/01/1977","0","8.2",-3,26,1977-01-03,"1977"
"779","Enero ",1,"04/01/1977","0","1.4",4,22,1977-01-04,"1977"
"780","Enero ",1,"05/01/1977","0","5.7",4,24,1977-01-05,"1977"
"781","Enero ",1,"06/01/1977","0","6.9",4,26,1977-01-06,"1977"
"782","Enero ",1,"07/01/1977","0","7.7",4,25,1977-01-07,"1977"
"783","Enero ",1,"08/01/1977","0","7.8",5,24,1977-01-08,"1977"
"784","Enero ",1,"09/01/1977","0","3.7",3,26,1977-01-09,"1977"
"785","Enero ",1,"10/01/1977","0","3.7",2,25,1977-01-10,"1977"
"786","Enero ",1,"11/01/1977","0","5.7",3,26,1977-01-11,"1977"
"787","Enero ",1,"12/01/1977","8.5","3.2",4,21,1977-01-12,"1977"
"788","Enero ",1,"13/01/1977","0.3","2",6,17,1977-01-13,"1977"
"789","Enero ",1,"14/01/1977","0","3",-2,20,1977-01-14,"1977"
"790","Enero ",1,"15/01/1977","0","4",2,18,1977-01-15,"1977"
"791","Enero ",1,"16/01/1977","0","3",3,20,1977-01-16,"1977"
"792","Enero ",1,"17/01/1977","0","4.2",2,23,1977-01-17,"1977"
"793","Enero ",1,"18/01/1977","0.2","1.6",6,19,1977-01-18,"1977"
"794","Enero ",1,"19/01/1977","0","2.8",7,19,1977-01-19,"1977"
"795","Enero ",1,"20/01/1977","4.4","1.8",2,23,1977-01-20,"1977"
"796","Enero ",1,"21/01/1977","0","5",9,21,1977-01-21,"1977"
"797","Enero ",1,"22/01/1977","0","2.9",7,20,1977-01-22,"1977"
"798","Enero ",1,"23/01/1977","0","3.4",6,24,1977-01-23,"1977"
"799","Enero ",1,"24/01/1977","0","5.2",4,26,1977-01-24,"1977"
"800","Enero ",1,"25/01/1977","0","3.9",6,21,1977-01-25,"1977"
"801","Enero ",1,"26/01/1977","0","5.2",8,24,1977-01-26,"1977"
"802","Enero ",1,"27/01/1977","0","3.7",6,20,1977-01-27,"1977"
"803","Enero ",1,"28/01/1977","0","4.1",9,20,1977-01-28,"1977"
"804","Enero ",1,"29/01/1977","0","4.2",8,19,1977-01-29,"1977"
"805","Enero ",1,"30/01/1977","0","6.1",7,26,1977-01-30,"1977"
"806","Enero ",1,"31/01/1977","0","2.9",3,20,1977-01-31,"1977"
"807","Enero ",1,"01/01/1978","0","4.3",4,21,1978-01-01,"1978"
"808","Enero ",1,"02/01/1978","0","6.1",3,23,1978-01-02,"1978"
"809","Enero ",1,"03/01/1978","0","6.6",5,25,1978-01-03,"1978"
"810","Enero ",1,"04/01/1978","0","5.1",2,24,1978-01-04,"1978"
"811","Enero ",1,"05/01/1978","0","10.3",3,24,1978-01-05,"1978"
"812","Enero ",1,"06/01/1978","0","5.9",4,23,1978-01-06,"1978"
"813","Enero ",1,"07/01/1978","0","2.7",7,20,1978-01-07,"1978"
"814","Enero ",1,"08/01/1978","0","3.2",-1,20,1978-01-08,"1978"
"815","Enero ",1,"09/01/1978","0","2.4",-1,21,1978-01-09,"1978"
"816","Enero ",1,"10/01/1978","0","2.4",2,20,1978-01-10,"1978"
"817","Enero ",1,"11/01/1978","0","6.8",-1,19,1978-01-11,"1978"
"818","Enero ",1,"12/01/1978","0","5.9",2,21,1978-01-12,"1978"
"819","Enero ",1,"13/01/1978","0","6.8",4,20,1978-01-13,"1978"
"820","Enero ",1,"14/01/1978","0","9.9",4,18,1978-01-14,"1978"
"821","Enero ",1,"15/01/1978","0","3",6,19.5,1978-01-15,"1978"
"822","Enero ",1,"16/01/1978","0","4.6",3,25,1978-01-16,"1978"
"823","Enero ",1,"17/01/1978","0","6.6",4,20,1978-01-17,"1978"
"824","Enero ",1,"18/01/1978","0","6.6",5,17,1978-01-18,"1978"
"825","Enero ",1,"19/01/1978","0","2.4",-2.5,19,1978-01-19,"1978"
"826","Enero ",1,"20/01/1978","0","7.4",-3,20,1978-01-20,"1978"
"827","Enero ",1,"21/01/1978","0","5.6",4,18,1978-01-21,"1978"
"828","Enero ",1,"22/01/1978","0","7.4",3,17,1978-01-22,"1978"
"829","Enero ",1,"23/01/1978","0","5.6",-1,19.5,1978-01-23,"1978"
"830","Enero ",1,"24/01/1978","0","3.7",8,17,1978-01-24,"1978"
"831","Enero ",1,"25/01/1978","0","6.2",2,16,1978-01-25,"1978"
"832","Enero ",1,"26/01/1978","0","4.7",-1,14,1978-01-26,"1978"
"833","Enero ",1,"27/01/1978","0","4.7",-3,15,1978-01-27,"1978"
"834","Enero ",1,"28/01/1978","0","4.6",-2,16,1978-01-28,"1978"
"835","Enero ",1,"29/01/1978","0","9.3",2,17,1978-01-29,"1978"
"836","Enero ",1,"30/01/1978","0","3.5",4,15,1978-01-30,"1978"
"837","Enero ",1,"31/01/1978","0","3.2",5,14,1978-01-31,"1978"
"838","Enero ",1,"01/01/1979","0","5.6",4,18,1979-01-01,"1979"
"839","Enero ",1,"02/01/1979","0","5.8",3,16,1979-01-02,"1979"
"840","Enero ",1,"03/01/1979","0","7.1",-1,20,1979-01-03,"1979"
"841","Enero ",1,"04/01/1979","0","8.1",-2,21.5,1979-01-04,"1979"
"842","Enero ",1,"05/01/1979","0","6.4",0,20,1979-01-05,"1979"
"843","Enero ",1,"06/01/1979","0","7.2",3,19,1979-01-06,"1979"
"844","Enero ",1,"07/01/1979","0","5.6",6,22,1979-01-07,"1979"
"845","Enero ",1,"08/01/1979","0","6.4",3,22.5,1979-01-08,"1979"
"846","Enero ",1,"09/01/1979","0","4.7",2,20,1979-01-09,"1979"
"847","Enero ",1,"10/01/1979","0","7.1",4,22,1979-01-10,"1979"
"848","Enero ",1,"11/01/1979","0","3.6",4,20.5,1979-01-11,"1979"
"849","Enero ",1,"12/01/1979","0","4.9",2,21.5,1979-01-12,"1979"
"850","Enero ",1,"13/01/1979","0","5.1",3,20,1979-01-13,"1979"
"851","Enero ",1,"14/01/1979","0","4.4",4,25.5,1979-01-14,"1979"
"852","Enero ",1,"15/01/1979","0","5.1",5,22,1979-01-15,"1979"
"853","Enero ",1,"16/01/1979","0","4.9",7.5,17,1979-01-16,"1979"
"854","Enero ",1,"17/01/1979","0","5.5",7,21,1979-01-17,"1979"
"855","Enero ",1,"18/01/1979","0","3",6.5,21.5,1979-01-18,"1979"
"856","Enero ",1,"19/01/1979","0","6.6",8.5,21.5,1979-01-19,"1979"
"857","Enero ",1,"20/01/1979","0","8.2",4.5,21,1979-01-20,"1979"
"858","Enero ",1,"21/01/1979","0","3.6",-1,20,1979-01-21,"1979"
"859","Enero ",1,"22/01/1979","0","3.7",2,18.5,1979-01-22,"1979"
"860","Enero ",1,"23/01/1979","0","4.9",3,17,1979-01-23,"1979"
"861","Enero ",1,"24/01/1979","10.2","1.7",5,17.5,1979-01-24,"1979"
"862","Enero ",1,"25/01/1979","3.1","2.4",8.5,17,1979-01-25,"1979"
"863","Enero ",1,"26/01/1979","0","3.4",6.5,19,1979-01-26,"1979"
"864","Enero ",1,"27/01/1979","0","4.1",7.5,19,1979-01-27,"1979"
"865","Enero ",1,"28/01/1979","0.2","3.5",6,19.5,1979-01-28,"1979"
"866","Enero ",1,"29/01/1979","0","4.3",5.5,18.5,1979-01-29,"1979"
"867","Enero ",1,"30/01/1979","0","5.5",7,20,1979-01-30,"1979"
"868","Enero ",1,"31/01/1979","0","5.4",4.5,21.5,1979-01-31,"1979"
"869","Enero ",1,"01/01/1980","0","5.6",-1,22,1980-01-01,"1980"
"870","Enero ",1,"02/01/1980","0","5.2",3,19,1980-01-02,"1980"
"871","Enero ",1,"03/01/1980","0","5.3",2,19,1980-01-03,"1980"
"872","Enero ",1,"04/01/1980","0","4.7",-3,19,1980-01-04,"1980"
"873","Enero ",1,"05/01/1980","0","3.7",0.5,21,1980-01-05,"1980"
"874","Enero ",1,"06/01/1980","0","5.5",1,20,1980-01-06,"1980"
"875","Enero ",1,"07/01/1980","0","5.3",3,19,1980-01-07,"1980"
"876","Enero ",1,"08/01/1980","0","6.5",5,23,1980-01-08,"1980"
"877","Enero ",1,"09/01/1980","0","5.3",2,23,1980-01-09,"1980"
"878","Enero ",1,"10/01/1980","0","4.6",4,21.5,1980-01-10,"1980"
"879","Enero ",1,"11/01/1980","0","5.5",2,21,1980-01-11,"1980"
"880","Enero ",1,"12/01/1980","0","5.1",4,24,1980-01-12,"1980"
"881","Enero ",1,"13/01/1980","0","6.6",2,26,1980-01-13,"1980"
"882","Enero ",1,"14/01/1980","0","6",4,25,1980-01-14,"1980"
"883","Enero ",1,"15/01/1980","0","5.7",6,24,1980-01-15,"1980"
"884","Enero ",1,"16/01/1980","0","4.7",4.5,24,1980-01-16,"1980"
"885","Enero ",1,"17/01/1980","0","5.4",4,23,1980-01-17,"1980"
"886","Enero ",1,"18/01/1980","0","5.9",3,25,1980-01-18,"1980"
"887","Enero ",1,"19/01/1980","0","6.7",4,24,1980-01-19,"1980"
"888","Enero ",1,"20/01/1980","0","5.6",6,23,1980-01-20,"1980"
"889","Enero ",1,"21/01/1980","0","3.6",8,19,1980-01-21,"1980"
"890","Enero ",1,"22/01/1980","0","3.7",8,19,1980-01-22,"1980"
"891","Enero ",1,"23/01/1980","1.5","1.2",1,16,1980-01-23,"1980"
"892","Enero ",1,"24/01/1980","8","0.4",1,6,1980-01-24,"1980"
"893","Enero ",1,"25/01/1980","0","1.6",-3,16,1980-01-25,"1980"
"894","Enero ",1,"26/01/1980","0","3.6",1,18,1980-01-26,"1980"
"895","Enero ",1,"27/01/1980","0","3.8",1,23,1980-01-27,"1980"
"896","Enero ",1,"28/01/1980","0","5.4",1,21.5,1980-01-28,"1980"
"897","Enero ",1,"29/01/1980","0","6.7",1,23,1980-01-29,"1980"
"898","Enero ",1,"30/01/1980","0","6.3",2,27,1980-01-30,"1980"
"899","Enero ",1,"31/01/1980","0","6.8",4,26,1980-01-31,"1980"
"900","Enero ",1,"01/01/1981","0","3.7",-1,20,1981-01-01,"1981"
"901","Enero ",1,"02/01/1981","0","4",-1.5,21.5,1981-01-02,"1981"
"902","Enero ",1,"03/01/1981","0","4.1",-1.5,22.5,1981-01-03,"1981"
"903","Enero ",1,"04/01/1981","0","5.2",1,18.5,1981-01-04,"1981"
"904","Enero ",1,"05/01/1981","0.8","5.9",3.5,22,1981-01-05,"1981"
"905","Enero ",1,"06/01/1981","0","3.1",3.5,17.5,1981-01-06,"1981"
"906","Enero ",1,"07/01/1981","0","5.7",4.5,19,1981-01-07,"1981"
"907","Enero ",1,"08/01/1981","0","3.7",5,18,1981-01-08,"1981"
"908","Enero ",1,"09/01/1981","0","3.6",-0.5,20,1981-01-09,"1981"
"909","Enero ",1,"10/01/1981","0","3.1",1.5,19.5,1981-01-10,"1981"
"910","Enero ",1,"11/01/1981","3.3","1.8",2,23,1981-01-11,"1981"
"911","Enero ",1,"12/01/1981","1.2","1.9",3.5,24,1981-01-12,"1981"
"912","Enero ",1,"13/01/1981","0","2.4",4,18.5,1981-01-13,"1981"
"913","Enero ",1,"14/01/1981","0","2.2",2,19,1981-01-14,"1981"
"914","Enero ",1,"15/01/1981","2.1","2.8",2,16,1981-01-15,"1981"
"915","Enero ",1,"16/01/1981","20.5","1.1",4,9,1981-01-16,"1981"
"916","Enero ",1,"17/01/1981","1.2","1.2",4.5,13,1981-01-17,"1981"
"917","Enero ",1,"18/01/1981","3.1","1.1",2,12,1981-01-18,"1981"
"918","Enero ",1,"19/01/1981","0","3",1.5,10.5,1981-01-19,"1981"
"919","Enero ",1,"20/01/1981","0","2.8",0,12.5,1981-01-20,"1981"
"920","Enero ",1,"21/01/1981","0","4",-1.5,11.5,1981-01-21,"1981"
"921","Enero ",1,"22/01/1981","0.5","3",-2,14.5,1981-01-22,"1981"
"922","Enero ",1,"23/01/1981","0","2.6",-6,12.5,1981-01-23,"1981"
"923","Enero ",1,"24/01/1981","0","3.1",-4,13.5,1981-01-24,"1981"
"924","Enero ",1,"25/01/1981","0","3",-2,17.5,1981-01-25,"1981"
"925","Enero ",1,"26/01/1981","1","3.1",-1,17,1981-01-26,"1981"
"926","Enero ",1,"27/01/1981","0","3.5",-1,18,1981-01-27,"1981"
"927","Enero ",1,"28/01/1981","0","3.5",-4,20,1981-01-28,"1981"
"928","Enero ",1,"29/01/1981","0","4",-3,24,1981-01-29,"1981"
"929","Enero ",1,"30/01/1981","0","4.1",0,24,1981-01-30,"1981"
"930","Enero ",1,"31/01/1981","0","4.2",2.5,23,1981-01-31,"1981"
"931","Enero ",1,"01/01/1982","0","Nulo",-2.4,20,1982-01-01,"1982"
"932","Enero ",1,"02/01/1982","0","Nulo",-1.5,21,1982-01-02,"1982"
"933","Enero ",1,"03/01/1982","0","Nulo",-3,19,1982-01-03,"1982"
"934","Enero ",1,"04/01/1982","0","Nulo",-1,18.5,1982-01-04,"1982"
"935","Enero ",1,"05/01/1982","0","Nulo",-2,18,1982-01-05,"1982"
"936","Enero ",1,"06/01/1982","0","Nulo",-1.5,19.5,1982-01-06,"1982"
"937","Enero ",1,"07/01/1982","0","Nulo",-2.5,20,1982-01-07,"1982"
"938","Enero ",1,"08/01/1982","0","Nulo",-1,21,1982-01-08,"1982"
"939","Enero ",1,"09/01/1982","0","Nulo",-1,20.5,1982-01-09,"1982"
"940","Enero ",1,"10/01/1982","0","Nulo",-2,20,1982-01-10,"1982"
"941","Enero ",1,"11/01/1982","0","Nulo",-2.5,21.5,1982-01-11,"1982"
"942","Enero ",1,"12/01/1982","0","Nulo",-1,20,1982-01-12,"1982"
"943","Enero ",1,"13/01/1982","0","Nulo",0,21,1982-01-13,"1982"
"944","Enero ",1,"14/01/1982","0","Nulo",-2,20.5,1982-01-14,"1982"
"945","Enero ",1,"15/01/1982","0","Nulo",-2.5,22.5,1982-01-15,"1982"
"946","Enero ",1,"16/01/1982","0","Nulo",-1.5,20,1982-01-16,"1982"
"947","Enero ",1,"17/01/1982","0","Nulo",-3.5,18.5,1982-01-17,"1982"
"948","Enero ",1,"18/01/1982","0","Nulo",-2.5,19,1982-01-18,"1982"
"949","Enero ",1,"19/01/1982","0","Nulo",-4,20.5,1982-01-19,"1982"
"950","Enero ",1,"20/01/1982","0","Nulo",-6,21.5,1982-01-20,"1982"
"951","Enero ",1,"21/01/1982","0","Nulo",-1,22,1982-01-21,"1982"
"952","Enero ",1,"22/01/1982","0","Nulo",-2.5,19.5,1982-01-22,"1982"
"953","Enero ",1,"23/01/1982","0","Nulo",-8,23,1982-01-23,"1982"
"954","Enero ",1,"24/01/1982","0","Nulo",2,22.5,1982-01-24,"1982"
"955","Enero ",1,"25/01/1982","0","Nulo",3,20.5,1982-01-25,"1982"
"956","Enero ",1,"26/01/1982","0","Nulo",1.5,20,1982-01-26,"1982"
"957","Enero ",1,"27/01/1982","0","Nulo",-1.5,21.5,1982-01-27,"1982"
"958","Enero ",1,"28/01/1982","0","Nulo",1.5,20.5,1982-01-28,"1982"
"959","Enero ",1,"29/01/1982","0","Nulo",-1.5,21.5,1982-01-29,"1982"
"960","Enero ",1,"30/01/1982","0","Nulo",-2.5,22,1982-01-30,"1982"
"961","Enero ",1,"31/01/1982","0","Nulo",-4,20,1982-01-31,"1982"
"962","Enero ",1,"01/01/1983","0","Nulo",0,15,1983-01-01,"1983"
"963","Enero ",1,"02/01/1983","0","Nulo",1.5,15.5,1983-01-02,"1983"
"964","Enero ",1,"03/01/1983","0","Nulo",2.5,16,1983-01-03,"1983"
"965","Enero ",1,"04/01/1983","0","Nulo",4.5,12.5,1983-01-04,"1983"
"966","Enero ",1,"05/01/1983","0","Nulo",1,18,1983-01-05,"1983"
"967","Enero ",1,"06/01/1983","0","Nulo",3.5,18.5,1983-01-06,"1983"
"968","Enero ",1,"07/01/1983","0","Nulo",3.5,20,1983-01-07,"1983"
"969","Enero ",1,"08/01/1983","0","Nulo",3.5,20,1983-01-08,"1983"
"970","Enero ",1,"09/01/1983","0","Nulo",3,19,1983-01-09,"1983"
"971","Enero ",1,"10/01/1983","0","Nulo",4.5,21,1983-01-10,"1983"
"972","Enero ",1,"11/01/1983","0","Nulo",6.5,18.5,1983-01-11,"1983"
"973","Enero ",1,"12/01/1983","0","Nulo",8.5,16.5,1983-01-12,"1983"
"974","Enero ",1,"13/01/1983","3.5","Nulo",5.5,15.5,1983-01-13,"1983"
"975","Enero ",1,"14/01/1983","2.1","Nulo",5,16,1983-01-14,"1983"
"976","Enero ",1,"15/01/1983","6.2","Nulo",7.5,15,1983-01-15,"1983"
"977","Enero ",1,"16/01/1983","0","Nulo",11,16.5,1983-01-16,"1983"
"978","Enero ",1,"17/01/1983","0","Nulo",3.5,15.5,1983-01-17,"1983"
"979","Enero ",1,"18/01/1983","0","Nulo",5,15.5,1983-01-18,"1983"
"980","Enero ",1,"19/01/1983","0","Nulo",3.5,16.5,1983-01-19,"1983"
"981","Enero ",1,"20/01/1983","0","Nulo",5,11,1983-01-20,"1983"
"982","Enero ",1,"21/01/1983","0","Nulo",1.5,11.5,1983-01-21,"1983"
"983","Enero ",1,"22/01/1983","0","Nulo",-2.5,13.5,1983-01-22,"1983"
"984","Enero ",1,"23/01/1983","0","Nulo",-1,13,1983-01-23,"1983"
"985","Enero ",1,"24/01/1983","0","Nulo",0,16.5,1983-01-24,"1983"
"986","Enero ",1,"25/01/1983","0","Nulo",1,17.5,1983-01-25,"1983"
"987","Enero ",1,"26/01/1983","0","4.9",1.5,20.5,1983-01-26,"1983"
"988","Enero ",1,"27/01/1983","0","4.2",0.5,22,1983-01-27,"1983"
"989","Enero ",1,"28/01/1983","0","2.7",0.5,22.5,1983-01-28,"1983"
"990","Enero ",1,"29/01/1983","0","9.6",2.5,23.5,1983-01-29,"1983"
"991","Enero ",1,"30/01/1983","0","9.3",4.5,21.5,1983-01-30,"1983"
"992","Enero ",1,"31/01/1983","0","5.7",5.5,16,1983-01-31,"1983"
"993","Enero ",1,"01/01/1984","0","3.5",0,18.5,1984-01-01,"1984"
"994","Enero ",1,"02/01/1984","0","4.8",4,16.5,1984-01-02,"1984"
"995","Enero ",1,"03/01/1984","2.5","0.2",3.5,15.5,1984-01-03,"1984"
"996","Enero ",1,"04/01/1984","0.7","0.3",7,16,1984-01-04,"1984"
"997","Enero ",1,"05/01/1984","7","4.3",8.5,19.5,1984-01-05,"1984"
"998","Enero ",1,"06/01/1984","0","3.2",8,19,1984-01-06,"1984"
"999","Enero ",1,"07/01/1984","0","2.8",9.5,20.5,1984-01-07,"1984"
"1000","Enero ",1,"08/01/1984","0","4.9",-2,19.5,1984-01-08,"1984"
"1001","Enero ",1,"09/01/1984","0","3.8",-3,18.5,1984-01-09,"1984"
"1002","Enero ",1,"10/01/1984","0","2.3",-1,15.5,1984-01-10,"1984"
"1003","Enero ",1,"11/01/1984","0","4",1.5,16.5,1984-01-11,"1984"
"1004","Enero ",1,"12/01/1984","0","3.1",-2.5,18.5,1984-01-12,"1984"
"1005","Enero ",1,"13/01/1984","0","4.8",-2,19.5,1984-01-13,"1984"
"1006","Enero ",1,"14/01/1984","0","5.3",1.5,20,1984-01-14,"1984"
"1007","Enero ",1,"15/01/1984","0","2.2",3,18.5,1984-01-15,"1984"
"1008","Enero ",1,"16/01/1984","0","4",3.5,20,1984-01-16,"1984"
"1009","Enero ",1,"17/01/1984","0","4.6",-2,20.5,1984-01-17,"1984"
"1010","Enero ",1,"18/01/1984","0","2.2",3,18.5,1984-01-18,"1984"
"1011","Enero ",1,"19/01/1984","0","4.7",7,20.5,1984-01-19,"1984"
"1012","Enero ",1,"20/01/1984","0","5",-2,20,1984-01-20,"1984"
"1013","Enero ",1,"21/01/1984","0","2.8",0,18.5,1984-01-21,"1984"
"1014","Enero ",1,"22/01/1984","0","2.4",-6.5,21.5,1984-01-22,"1984"
"1015","Enero ",1,"23/01/1984","0","2.7",-3,18,1984-01-23,"1984"
"1016","Enero ",1,"24/01/1984","0","3.1",-2,19.5,1984-01-24,"1984"
"1017","Enero ",1,"25/01/1984","0","3.5",-3.5,15.5,1984-01-25,"1984"
"1018","Enero ",1,"26/01/1984","0","4.1",-1,20.5,1984-01-26,"1984"
"1019","Enero ",1,"27/01/1984","0","4.2",-2.5,21,1984-01-27,"1984"
"1020","Enero ",1,"28/01/1984","0","5",1.5,22.5,1984-01-28,"1984"
"1021","Enero ",1,"29/01/1984","20","4.1",2,18.5,1984-01-29,"1984"
"1022","Enero ",1,"30/01/1984","24.2","4.9",0,16.5,1984-01-30,"1984"
"1023","Enero ",1,"31/01/1984","0","5.1",1.5,18.5,1984-01-31,"1984"
"1024","Enero ",1,"01/01/1985","0","Nulo",-2.5,17.5,1985-01-01,"1985"
"1025","Enero ",1,"02/01/1985","0","Nulo",-3,13.5,1985-01-02,"1985"
"1026","Enero ",1,"03/01/1985","0","Nulo",-2,10,1985-01-03,"1985"
"1027","Enero ",1,"04/01/1985","0","Nulo",-6,7,1985-01-04,"1985"
"1028","Enero ",1,"05/01/1985","0","Nulo",-8,9.5,1985-01-05,"1985"
"1029","Enero ",1,"06/01/1985","0","Nulo",-6.5,13.5,1985-01-06,"1985"
"1030","Enero ",1,"07/01/1985","0","Nulo",-4.5,16.5,1985-01-07,"1985"
"1031","Enero ",1,"08/01/1985","0","Nulo",-1,19,1985-01-08,"1985"
"1032","Enero ",1,"09/01/1985","0","Nulo",0,23,1985-01-09,"1985"
"1033","Enero ",1,"10/01/1985","0","Nulo",0,19,1985-01-10,"1985"
"1034","Enero ",1,"11/01/1985","0","Nulo",6,16.5,1985-01-11,"1985"
"1035","Enero ",1,"12/01/1985","0","Nulo",7,15,1985-01-12,"1985"
"1036","Enero ",1,"13/01/1985","0","Nulo",10,14,1985-01-13,"1985"
"1037","Enero ",1,"14/01/1985","0","Nulo",9.5,14.5,1985-01-14,"1985"
"1038","Enero ",1,"15/01/1985","0","Nulo",6.5,14,1985-01-15,"1985"
"1039","Enero ",1,"16/01/1985","0","Nulo",0,13,1985-01-16,"1985"
"1040","Enero ",1,"17/01/1985","0","Nulo",-3,15.5,1985-01-17,"1985"
"1041","Enero ",1,"18/01/1985","0","Nulo",-1,17,1985-01-18,"1985"
"1042","Enero ",1,"19/01/1985","0","Nulo",1,18.5,1985-01-19,"1985"
"1043","Enero ",1,"20/01/1985","0","Nulo",-1.5,16,1985-01-20,"1985"
"1044","Enero ",1,"21/01/1985","0","Nulo",-0.5,17.5,1985-01-21,"1985"
"1045","Enero ",1,"22/01/1985","0","Nulo",4,21.5,1985-01-22,"1985"
"1046","Enero ",1,"23/01/1985","0","Nulo",6.5,17.5,1985-01-23,"1985"
"1047","Enero ",1,"24/01/1985","0","Nulo",6,19.5,1985-01-24,"1985"
"1048","Enero ",1,"25/01/1985","0","Nulo",7.5,21.5,1985-01-25,"1985"
"1049","Enero ",1,"26/01/1985","0","Nulo",4.5,22,1985-01-26,"1985"
"1050","Enero ",1,"27/01/1985","0","Nulo",2.5,22.5,1985-01-27,"1985"
"1051","Enero ",1,"28/01/1985","0","Nulo",0,21.5,1985-01-28,"1985"
"1052","Enero ",1,"29/01/1985","0","Nulo",1,19.5,1985-01-29,"1985"
"1053","Enero ",1,"30/01/1985","0","Nulo",0,21,1985-01-30,"1985"
"1054","Enero ",1,"31/01/1985","0","Nulo",2,16.5,1985-01-31,"1985"
"1055","Enero ",1,"01/01/1986","0","Nulo",3.3,22.5,1986-01-01,"1986"
"1056","Enero ",1,"02/01/1986","0","Nulo",3.6,23.5,1986-01-02,"1986"
"1057","Enero ",1,"03/01/1986","0","Nulo",3.2,26.7,1986-01-03,"1986"
"1058","Enero ",1,"04/01/1986","0","Nulo",4.4,24.6,1986-01-04,"1986"
"1059","Enero ",1,"05/01/1986","0","Nulo",-0.5,25.3,1986-01-05,"1986"
"1060","Enero ",1,"06/01/1986","0","Nulo",-0.5,23.5,1986-01-06,"1986"
"1061","Enero ",1,"07/01/1986","0","Nulo",-1.2,22.5,1986-01-07,"1986"
"1062","Enero ",1,"08/01/1986","0","Nulo",-1.3,10.5,1986-01-08,"1986"
"1063","Enero ",1,"09/01/1986","0","Nulo",-2.8,9.7,1986-01-09,"1986"
"1064","Enero ",1,"10/01/1986","0","Nulo",-1.1,14.2,1986-01-10,"1986"
"1065","Enero ",1,"11/01/1986","0","Nulo",-0.8,11.6,1986-01-11,"1986"
"1066","Enero ",1,"12/01/1986","0","Nulo",-5.8,13.8,1986-01-12,"1986"
"1067","Enero ",1,"13/01/1986","0","Nulo",-4.8,19.5,1986-01-13,"1986"
"1068","Enero ",1,"14/01/1986","0","Nulo",-2.3,15.5,1986-01-14,"1986"
"1069","Enero ",1,"15/01/1986","0","Nulo",0.9,16.8,1986-01-15,"1986"
"1070","Enero ",1,"16/01/1986","0","Nulo",2.2,19.2,1986-01-16,"1986"
"1071","Enero ",1,"17/01/1986","0","Nulo",-1.2,18.2,1986-01-17,"1986"
"1072","Enero ",1,"18/01/1986","0","Nulo",-2.8,17.2,1986-01-18,"1986"
"1073","Enero ",1,"19/01/1986","0","Nulo",-0.6,20.8,1986-01-19,"1986"
"1074","Enero ",1,"20/01/1986","0","Nulo",-2.8,22.2,1986-01-20,"1986"
"1075","Enero ",1,"21/01/1986","0","Nulo",0,23.7,1986-01-21,"1986"
"1076","Enero ",1,"22/01/1986","0","Nulo",3.2,23.2,1986-01-22,"1986"
"1077","Enero ",1,"23/01/1986","0","Nulo",5.3,24.7,1986-01-23,"1986"
"1078","Enero ",1,"24/01/1986","0","Nulo",6.2,25.2,1986-01-24,"1986"
"1079","Enero ",1,"25/01/1986","0","Nulo",2.4,23.7,1986-01-25,"1986"
"1080","Enero ",1,"26/01/1986","0","Nulo",-2.6,20.5,1986-01-26,"1986"
"1081","Enero ",1,"27/01/1986","0","Nulo",2.3,25.5,1986-01-27,"1986"
"1082","Enero ",1,"28/01/1986","0","Nulo",-4,24.5,1986-01-28,"1986"
"1083","Enero ",1,"29/01/1986","0","Nulo",0,22.5,1986-01-29,"1986"
"1084","Enero ",1,"30/01/1986","0","Nulo",2,20.4,1986-01-30,"1986"
"1085","Enero ",1,"31/01/1986","0","Nulo",0,20.1,1986-01-31,"1986"
"1086","Enero ",1,"01/01/1987","0","Nulo",-4.8,15.8,1987-01-01,"1987"
"1087","Enero ",1,"02/01/1987","0","Nulo",-3.6,21.3,1987-01-02,"1987"
"1088","Enero ",1,"03/01/1987","0","Nulo",-2.7,20.3,1987-01-03,"1987"
"1089","Enero ",1,"04/01/1987","0","Nulo",-2.8,22.8,1987-01-04,"1987"
"1090","Enero ",1,"05/01/1987","0","Nulo",-1.3,23.4,1987-01-05,"1987"
"1091","Enero ",1,"06/01/1987","0","Nulo",-2.2,24.4,1987-01-06,"1987"
"1092","Enero ",1,"07/01/1987","0","Nulo",2.8,25.6,1987-01-07,"1987"
"1093","Enero ",1,"08/01/1987","0","Nulo",5.2,23.4,1987-01-08,"1987"
"1094","Enero ",1,"09/01/1987","0","Nulo",2.4,22.3,1987-01-09,"1987"
"1095","Enero ",1,"10/01/1987","0","Nulo",-1.4,31,1987-01-10,"1987"
"1096","Enero ",1,"11/01/1987","0","Nulo",-0.8,12,1987-01-11,"1987"
"1097","Enero ",1,"12/01/1987","20.1","Nulo",-5.3,3.2,1987-01-12,"1987"
"1098","Enero ",1,"13/01/1987","32.3","Nulo",-1.3,5.7,1987-01-13,"1987"
"1099","Enero ",1,"14/01/1987","9.4","Nulo",-7.8,11.7,1987-01-14,"1987"
"1100","Enero ",1,"15/01/1987","0","Nulo",-4.7,16.3,1987-01-15,"1987"
"1101","Enero ",1,"16/01/1987","0","Nulo",-6.3,17.2,1987-01-16,"1987"
"1102","Enero ",1,"17/01/1987","0","Nulo",-5.1,16.1,1987-01-17,"1987"
"1103","Enero ",1,"18/01/1987","0","Nulo",-2.3,14.8,1987-01-18,"1987"
"1104","Enero ",1,"19/01/1987","0","Nulo",-3.8,16.2,1987-01-19,"1987"
"1105","Enero ",1,"20/01/1987","0","Nulo",-0.8,15.4,1987-01-20,"1987"
"1106","Enero ",1,"21/01/1987","0","Nulo",-4.7,11.2,1987-01-21,"1987"
"1107","Enero ",1,"22/01/1987","0","Nulo",-5.3,12.4,1987-01-22,"1987"
"1108","Enero ",1,"23/01/1987","0","Nulo",-2.4,19.7,1987-01-23,"1987"
"1109","Enero ",1,"24/01/1987","0","Nulo",-1.3,20.8,1987-01-24,"1987"
"1110","Enero ",1,"25/01/1987","0","Nulo",-0.8,21.2,1987-01-25,"1987"
"1111","Enero ",1,"26/01/1987","0","Nulo",-1.3,20.8,1987-01-26,"1987"
"1112","Enero ",1,"27/01/1987","0","Nulo",-1.4,21.7,1987-01-27,"1987"
"1113","Enero ",1,"28/01/1987","0","Nulo",0.2,25.8,1987-01-28,"1987"
"1114","Enero ",1,"29/01/1987","0","Nulo",0.2,21.7,1987-01-29,"1987"
"1115","Enero ",1,"30/01/1987","0","Nulo",2.6,26.8,1987-01-30,"1987"
"1116","Enero ",1,"31/01/1987","0","Nulo",3.8,23.4,1987-01-31,"1987"
"1117","Enero ",1,"01/01/1991","0","Nulo",3,26.5,1991-01-01,"1991"
"1118","Enero ",1,"02/01/1991","0","Nulo",3,24.5,1991-01-02,"1991"
"1119","Enero ",1,"03/01/1991","0","Nulo",4,24.5,1991-01-03,"1991"
"1120","Enero ",1,"04/01/1991","0","Nulo",5,24.5,1991-01-04,"1991"
"1121","Enero ",1,"05/01/1991","0","Nulo",5,25,1991-01-05,"1991"
"1122","Enero ",1,"06/01/1991","0","Nulo",7,28,1991-01-06,"1991"
"1123","Enero ",1,"07/01/1991","0","Nulo",6,21,1991-01-07,"1991"
"1124","Enero ",1,"08/01/1991","0","Nulo",-0.5,24,1991-01-08,"1991"
"1125","Enero ",1,"09/01/1991","0","Nulo",0,21,1991-01-09,"1991"
"1126","Enero ",1,"10/01/1991","0","Nulo",5,20.5,1991-01-10,"1991"
"1127","Enero ",1,"11/01/1991","0","Nulo",-1,18,1991-01-11,"1991"
"1128","Enero ",1,"12/01/1991","0","Nulo",-2,18.5,1991-01-12,"1991"
"1129","Enero ",1,"13/01/1991","0","Nulo",-1.5,26,1991-01-13,"1991"
"1130","Enero ",1,"14/01/1991","0","Nulo",1.5,21.5,1991-01-14,"1991"
"1131","Enero ",1,"15/01/1991","0","Nulo",-3,21,1991-01-15,"1991"
"1132","Enero ",1,"16/01/1991","0","Nulo",-2,23,1991-01-16,"1991"
"1133","Enero ",1,"17/01/1991","0","Nulo",-1,20.5,1991-01-17,"1991"
"1134","Enero ",1,"18/01/1991","0","Nulo",-1,22,1991-01-18,"1991"
"1135","Enero ",1,"19/01/1991","0","Nulo",-3,19.5,1991-01-19,"1991"
"1136","Enero ",1,"20/01/1991","0","Nulo",-1.5,22,1991-01-20,"1991"
"1137","Enero ",1,"21/01/1991","0","Nulo",1,24,1991-01-21,"1991"
"1138","Enero ",1,"22/01/1991","0","Nulo",-1,23,1991-01-22,"1991"
"1139","Enero ",1,"23/01/1991","0","Nulo",3.5,20.5,1991-01-23,"1991"
"1140","Enero ",1,"24/01/1991","0","Nulo",6,25,1991-01-24,"1991"
"1141","Enero ",1,"25/01/1991","0","Nulo",-2,22,1991-01-25,"1991"
"1142","Enero ",1,"26/01/1991","0","Nulo",2,24.5,1991-01-26,"1991"
"1143","Enero ",1,"27/01/1991","0","Nulo",4.5,24,1991-01-27,"1991"
"1144","Enero ",1,"28/01/1991","0","Nulo",5,18,1991-01-28,"1991"
"1145","Enero ",1,"29/01/1991","0","Nulo",3,20.5,1991-01-29,"1991"
"1146","Enero ",1,"30/01/1991","0","Nulo",4,19,1991-01-30,"1991"
"1147","Enero ",1,"31/01/1991","0","Nulo",-2.5,16,1991-01-31,"1991"
"1148","Enero ",1,"01/01/1995","1.4","6.3",-3,20,1995-01-01,"1995"
"1149","Enero ",1,"02/01/1995","0","3",8,19,1995-01-02,"1995"
"1150","Enero ",1,"03/01/1995","0","7.1",3,19,1995-01-03,"1995"
"1151","Enero ",1,"04/01/1995","0","7.8",3,21,1995-01-04,"1995"
"1152","Enero ",1,"05/01/1995","0","7.9",4,20,1995-01-05,"1995"
"1153","Enero ",1,"06/01/1995","0","7.3",3,22,1995-01-06,"1995"
"1154","Enero ",1,"07/01/1995","0","8.7",-1,20,1995-01-07,"1995"
"1155","Enero ",1,"08/01/1995","0","8.3",-2,22,1995-01-08,"1995"
"1156","Enero ",1,"09/01/1995","0","7.4",-2,23,1995-01-09,"1995"
"1157","Enero ",1,"10/01/1995","0","7.4",3,24,1995-01-10,"1995"
"1158","Enero ",1,"11/01/1995","0","9.4",3,23,1995-01-11,"1995"
"1159","Enero ",1,"12/01/1995","0","6.5",3,21,1995-01-12,"1995"
"1160","Enero ",1,"13/01/1995","0","7.6",2,21,1995-01-13,"1995"
"1161","Enero ",1,"14/01/1995","0","5.3",1,20,1995-01-14,"1995"
"1162","Enero ",1,"15/01/1995","0","6.8",-1,22.5,1995-01-15,"1995"
"1163","Enero ",1,"16/01/1995","0","7.9",0,19,1995-01-16,"1995"
"1164","Enero ",1,"17/01/1995","0","7",4,17,1995-01-17,"1995"
"1165","Enero ",1,"18/01/1995","0","7.1",4,18,1995-01-18,"1995"
"1166","Enero ",1,"19/01/1995","0","7.9",5.5,24,1995-01-19,"1995"
"1167","Enero ",1,"20/01/1995","0","6.5",6,20,1995-01-20,"1995"
"1168","Enero ",1,"21/01/1995","0","4.7",7,19,1995-01-21,"1995"
"1169","Enero ",1,"22/01/1995","0","7.8",4,20,1995-01-22,"1995"
"1170","Enero ",1,"23/01/1995","0","6.8",6,21,1995-01-23,"1995"
"1171","Enero ",1,"24/01/1995","0","10.2",8,17,1995-01-24,"1995"
"1172","Enero ",1,"25/01/1995","0.9","5.2",6,20,1995-01-25,"1995"
"1173","Enero ",1,"26/01/1995","0","7.7",7.5,20,1995-01-26,"1995"
"1174","Enero ",1,"27/01/1995","0","4.2",2,22,1995-01-27,"1995"
"1175","Enero ",1,"28/01/1995","0","5.1",6,16,1995-01-28,"1995"
"1176","Enero ",1,"29/01/1995","0","4.3",4,20.5,1995-01-29,"1995"
"1177","Enero ",1,"30/01/1995","0","6.4",2,14,1995-01-30,"1995"
"1178","Enero ",1,"31/01/1995","0","5.3",-2,16,1995-01-31,"1995"
"1179","Enero ",1,"01/01/1996","0","6.9",2.5,16,1996-01-01,"1996"
"1180","Enero ",1,"02/01/1996","0","7",0.5,15,1996-01-02,"1996"
"1181","Enero ",1,"03/01/1996","0","9.8",0,13,1996-01-03,"1996"
"1182","Enero ",1,"04/01/1996","0","3.7",-2,20,1996-01-04,"1996"
"1183","Enero ",1,"05/01/1996","0","5.6",-2,19,1996-01-05,"1996"
"1184","Enero ",1,"06/01/1996","0","5.1",-2,20,1996-01-06,"1996"
"1185","Enero ",1,"07/01/1996","0","5.9",-2,19,1996-01-07,"1996"
"1186","Enero ",1,"08/01/1996","0","7.5",-2,18,1996-01-08,"1996"
"1187","Enero ",1,"09/01/1996","0","6.1",-1.5,20,1996-01-09,"1996"
"1188","Enero ",1,"10/01/1996","0","6.4",-0.5,21,1996-01-10,"1996"
"1189","Enero ",1,"11/01/1996","0","6.5",1,20,1996-01-11,"1996"
"1190","Enero ",1,"12/01/1996","0","8.1",0,18,1996-01-12,"1996"
"1191","Enero ",1,"13/01/1996","0","7.2",-2,22,1996-01-13,"1996"
"1192","Enero ",1,"14/01/1996","0","6.9",-2,24,1996-01-14,"1996"
"1193","Enero ",1,"15/01/1996","0","3.9",1,20,1996-01-15,"1996"
"1194","Enero ",1,"16/01/1996","0","6.4",0,24,1996-01-16,"1996"
"1195","Enero ",1,"17/01/1996","0","9.8",1,22,1996-01-17,"1996"
"1196","Enero ",1,"18/01/1996","0","9",6,20,1996-01-18,"1996"
"1197","Enero ",1,"19/01/1996","0","7",1,26,1996-01-19,"1996"
"1198","Enero ",1,"20/01/1996","0","8.6",1,25,1996-01-20,"1996"
"1199","Enero ",1,"21/01/1996","0","7.3",3,22,1996-01-21,"1996"
"1200","Enero ",1,"22/01/1996","0","5.4",4,23,1996-01-22,"1996"
"1201","Enero ",1,"23/01/1996","0","7.7",6,21,1996-01-23,"1996"
"1202","Enero ",1,"24/01/1996","0","8.3",-2,21,1996-01-24,"1996"
"1203","Enero ",1,"25/01/1996","0","7.3",-2,22.5,1996-01-25,"1996"
"1204","Enero ",1,"26/01/1996","0","8.7",1,24,1996-01-26,"1996"
"1205","Enero ",1,"27/01/1996","0","7.8",1,25,1996-01-27,"1996"
"1206","Enero ",1,"28/01/1996","0","9.4",1,23,1996-01-28,"1996"
"1207","Enero ",1,"29/01/1996","0","5.7",3,23,1996-01-29,"1996"
"1208","Enero ",1,"30/01/1996","0","7",3,25,1996-01-30,"1996"
"1209","Enero ",1,"31/01/1996","0","8.9",3,25,1996-01-31,"1996"
"1210","Enero ",1,"01/01/1997","0","6.9",2,21,1997-01-01,"1997"
"1211","Enero ",1,"02/01/1997","0","6.8",1,22,1997-01-02,"1997"
"1212","Enero ",1,"03/01/1997","0","2.6",1.5,22,1997-01-03,"1997"
"1213","Enero ",1,"04/01/1997","0","10.2",5,22,1997-01-04,"1997"
"1214","Enero ",1,"05/01/1997","0","7.2",4.5,22.5,1997-01-05,"1997"
"1215","Enero ",1,"06/01/1997","0","6.5",5,19,1997-01-06,"1997"
"1216","Enero ",1,"07/01/1997","0.3","6.1",5,14,1997-01-07,"1997"
"1217","Enero ",1,"08/01/1997","0","6.2",4,12,1997-01-08,"1997"
"1218","Enero ",1,"09/01/1997","0","7",-3,10,1997-01-09,"1997"
"1219","Enero ",1,"10/01/1997","0","3.5",-6,19,1997-01-10,"1997"
"1220","Enero ",1,"11/01/1997","0","2.4",-7,19,1997-01-11,"1997"
"1221","Enero ",1,"12/01/1997","0","3.8",-2,18,1997-01-12,"1997"
"1222","Enero ",1,"13/01/1997","0","3.2",-3,18,1997-01-13,"1997"
"1223","Enero ",1,"14/01/1997","0","1",-1.5,17.5,1997-01-14,"1997"
"1224","Enero ",1,"15/01/1997","0","3.3",-2,18,1997-01-15,"1997"
"1225","Enero ",1,"16/01/1997","0","5.1",-2,17,1997-01-16,"1997"
"1226","Enero ",1,"17/01/1997","9.8","5.2",2.5,15,1997-01-17,"1997"
"1227","Enero ",1,"18/01/1997","14.7","7.1",5,8,1997-01-18,"1997"
"1228","Enero ",1,"19/01/1997","31","1.4",4.5,7,1997-01-19,"1997"
"1229","Enero ",1,"20/01/1997","0","1.9",1,16,1997-01-20,"1997"
"1230","Enero ",1,"21/01/1997","0","1",1,20,1997-01-21,"1997"
"1231","Enero ",1,"22/01/1997","0","7.1",0,21,1997-01-22,"1997"
"1232","Enero ",1,"23/01/1997","0","6.4",-0.5,21.5,1997-01-23,"1997"
"1233","Enero ",1,"24/01/1997","0","6.9",0.5,21.5,1997-01-24,"1997"
"1234","Enero ",1,"25/01/1997","0","6.6",0,21,1997-01-25,"1997"
"1235","Enero ",1,"26/01/1997","0","5.8",2.5,23,1997-01-26,"1997"
"1236","Enero ",1,"27/01/1997","0","6.1",4.5,22,1997-01-27,"1997"
"1237","Enero ",1,"28/01/1997","0","5.3",1,16,1997-01-28,"1997"
"1238","Enero ",1,"29/01/1997","0","6",0.5,20,1997-01-29,"1997"
"1239","Enero ",1,"30/01/1997","0","5.9",1,18,1997-01-30,"1997"
"1240","Enero ",1,"31/01/1997","0","6.2",4.5,21,1997-01-31,"1997"
"1241","Enero ",1,"01/01/1998","0","2.4",1,17.5,1998-01-01,"1998"
"1242","Enero ",1,"02/01/1998","0","3",-1,17.5,1998-01-02,"1998"
"1243","Enero ",1,"03/01/1998","0","2",2,20,1998-01-03,"1998"
"1244","Enero ",1,"04/01/1998","0","2.6",3,21.5,1998-01-04,"1998"
"1245","Enero ",1,"05/01/1998","0","4.4",4,22,1998-01-05,"1998"
"1246","Enero ",1,"06/01/1998","0","3.2",3,17,1998-01-06,"1998"
"1247","Enero ",1,"07/01/1998","0","1.9",1,14.5,1998-01-07,"1998"
"1248","Enero ",1,"08/01/1998","0","1.9",-4,15,1998-01-08,"1998"
"1249","Enero ",1,"09/01/1998","0","3",-4,19,1998-01-09,"1998"
"1250","Enero ",1,"10/01/1998","0","2.3",0.5,19,1998-01-10,"1998"
"1251","Enero ",1,"11/01/1998","0","2.3",1,22,1998-01-11,"1998"
"1252","Enero ",1,"12/01/1998","0","4.3",2,18,1998-01-12,"1998"
"1253","Enero ",1,"13/01/1998","0","2.4",-3,20,1998-01-13,"1998"
"1254","Enero ",1,"14/01/1998","0","3.5",-3,18,1998-01-14,"1998"
"1255","Enero ",1,"15/01/1998","0","4.6",-3,17,1998-01-15,"1998"
"1256","Enero ",1,"16/01/1998","0","3.1",-4,21,1998-01-16,"1998"
"1257","Enero ",1,"17/01/1998","0","1.8",-3,17,1998-01-17,"1998"
"1258","Enero ",1,"18/01/1998","0","3.3",-1.5,20,1998-01-18,"1998"
"1259","Enero ",1,"19/01/1998","0","2.3",-1,21,1998-01-19,"1998"
"1260","Enero ",1,"20/01/1998","0","9.3",4,21,1998-01-20,"1998"
"1261","Enero ",1,"21/01/1998","0","4",5,21,1998-01-21,"1998"
"1262","Enero ",1,"22/01/1998","0","3.1",0,22,1998-01-22,"1998"
"1263","Enero ",1,"23/01/1998","0","3.2",0,22,1998-01-23,"1998"
"1264","Enero ",1,"24/01/1998","0","3.6",0,18.5,1998-01-24,"1998"
"1265","Enero ",1,"25/01/1998","0","3.6",0,20,1998-01-25,"1998"
"1266","Enero ",1,"26/01/1998","0","2.8",-0.5,19,1998-01-26,"1998"
"1267","Enero ",1,"27/01/1998","0","1.9",-1,20.5,1998-01-27,"1998"
"1268","Enero ",1,"28/01/1998","0","2.1",2,22,1998-01-28,"1998"
"1269","Enero ",1,"29/01/1998","0","3.5",4.5,21.5,1998-01-29,"1998"
"1270","Enero ",1,"30/01/1998","0","3.9",3.5,20,1998-01-30,"1998"
"1271","Enero ",1,"31/01/1998","0","3.9",2.5,22,1998-01-31,"1998"
"1272","Enero ",1,"01/01/1999","0","3",1,22,1999-01-01,"1999"
"1273","Enero ",1,"02/01/1999","0","3.9",0,17,1999-01-02,"1999"
"1274","Enero ",1,"03/01/1999","0","3.3",1,20.5,1999-01-03,"1999"
"1275","Enero ",1,"04/01/1999","0","4.7",0.5,15.5,1999-01-04,"1999"
"1276","Enero ",1,"05/01/1999","0","2.4",-5,17.5,1999-01-05,"1999"
"1277","Enero ",1,"06/01/1999","0","3.4",-4.5,19,1999-01-06,"1999"
"1278","Enero ",1,"07/01/1999","0","2.5",-2.5,22,1999-01-07,"1999"
"1279","Enero ",1,"08/01/1999","0","2.2",2,22.5,1999-01-08,"1999"
"1280","Enero ",1,"09/01/1999","0","5",2,17,1999-01-09,"1999"
"1281","Enero ",1,"10/01/1999","0","3.4",-3,18,1999-01-10,"1999"
"1282","Enero ",1,"11/01/1999","0","3.9",-2,23,1999-01-11,"1999"
"1283","Enero ",1,"12/01/1999","0","5.3",-1,22,1999-01-12,"1999"
"1284","Enero ",1,"13/01/1999","0","3.9",4,20,1999-01-13,"1999"
"1285","Enero ",1,"14/01/1999","0","4.6",1,19,1999-01-14,"1999"
"1286","Enero ",1,"15/01/1999","0","4.3",-0.5,20,1999-01-15,"1999"
"1287","Enero ",1,"16/01/1999","0","4.5",0,20,1999-01-16,"1999"
"1288","Enero ",1,"17/01/1999","0","4.2",0,20,1999-01-17,"1999"
"1289","Enero ",1,"18/01/1999","0","5",0.5,22,1999-01-18,"1999"
"1290","Enero ",1,"19/01/1999","0","5.6",1,24,1999-01-19,"1999"
"1291","Enero ",1,"20/01/1999","0","5.2",1.5,24,1999-01-20,"1999"
"1292","Enero ",1,"21/01/1999","0","5.2",3,25,1999-01-21,"1999"
"1293","Enero ",1,"22/01/1999","0","6",4,22.5,1999-01-22,"1999"
"1294","Enero ",1,"23/01/1999","0","6.6",-2,20,1999-01-23,"1999"
"1295","Enero ",1,"24/01/1999","0","3.5",-2.5,21,1999-01-24,"1999"
"1296","Enero ",1,"25/01/1999","0","5",-3,22.5,1999-01-25,"1999"
"1297","Enero ",1,"26/01/1999","0","5.2",-1.5,24,1999-01-26,"1999"
"1298","Enero ",1,"27/01/1999","0","4.3",2,22,1999-01-27,"1999"
"1299","Enero ",1,"28/01/1999","0","4.4",2,22,1999-01-28,"1999"
"1300","Enero ",1,"29/01/1999","0","7.3",6,20,1999-01-29,"1999"
"1301","Enero ",1,"30/01/1999","0","5.3",-1.5,21,1999-01-30,"1999"
"1302","Enero ",1,"31/01/1999","0","4.1",-1,25,1999-01-31,"1999"
"1303","Enero ",1,"01/01/2000","0","Nulo",2.5,23,2000-01-01,"2000"
"1304","Enero ",1,"02/01/2000","0","Nulo",3,22.5,2000-01-02,"2000"
"1305","Enero ",1,"03/01/2000","0","Nulo",6,23.5,2000-01-03,"2000"
"1306","Enero ",1,"04/01/2000","0","Nulo",2,15,2000-01-04,"2000"
"1307","Enero ",1,"05/01/2000","0","Nulo",-3,21.5,2000-01-05,"2000"
"1308","Enero ",1,"06/01/2000","0","Nulo",-2.6,21,2000-01-06,"2000"
"1309","Enero ",1,"07/01/2000","0","Nulo",-0.7,21,2000-01-07,"2000"
"1310","Enero ",1,"08/01/2000","0","Nulo",-3,21,2000-01-08,"2000"
"1311","Enero ",1,"09/01/2000","0","Nulo",-2.2,21.5,2000-01-09,"2000"
"1312","Enero ",1,"10/01/2000","0","Nulo",-1.7,21.5,2000-01-10,"2000"
"1313","Enero ",1,"11/01/2000","0","Nulo",-1.5,23,2000-01-11,"2000"
"1314","Enero ",1,"12/01/2000","0","4.8",0.7,24,2000-01-12,"2000"
"1315","Enero ",1,"13/01/2000","0","4.8",2,22.5,2000-01-13,"2000"
"1316","Enero ",1,"14/01/2000","0","6.4",2,18,2000-01-14,"2000"
"1317","Enero ",1,"15/01/2000","0","4.2",3.5,19,2000-01-15,"2000"
"1318","Enero ",1,"16/01/2000","0","4.6",3.5,20,2000-01-16,"2000"
"1319","Enero ",1,"17/01/2000","0","3.6",3.2,20,2000-01-17,"2000"
"1320","Enero ",1,"18/01/2000","0","4.3",2.6,21,2000-01-18,"2000"
"1321","Enero ",1,"19/01/2000","0","5.1",1.5,22,2000-01-19,"2000"
"1322","Enero ",1,"20/01/2000","0","4",1.3,22.5,2000-01-20,"2000"
"1323","Enero ",1,"21/01/2000","0","5",1.4,23,2000-01-21,"2000"
"1324","Enero ",1,"22/01/2000","0","4.4",1.4,24.5,2000-01-22,"2000"
"1325","Enero ",1,"23/01/2000","0","6.2",1.2,21,2000-01-23,"2000"
"1326","Enero ",1,"24/01/2000","0","4.4",2.6,23.5,2000-01-24,"2000"
"1327","Enero ",1,"25/01/2000","0","4.9",2.6,23.6,2000-01-25,"2000"
"1328","Enero ",1,"26/01/2000","0","6.3",4.5,26.2,2000-01-26,"2000"
"1329","Enero ",1,"27/01/2000","0","6.5",4.6,24,2000-01-27,"2000"
"1330","Enero ",1,"28/01/2000","0","7.1",2.5,25,2000-01-28,"2000"
"1331","Enero ",1,"29/01/2000","0","5.8",0.5,20,2000-01-29,"2000"
"1332","Enero ",1,"30/01/2000","0","5.7",1,23,2000-01-30,"2000"
"1333","Enero ",1,"31/01/2000","0","8.4",3.5,22.5,2000-01-31,"2000"
"1334","Febrero",2,"01/02/1941","0","5.5",6,20,1941-02-01,"1941"
"1335","Febrero",2,"02/02/1941","0","6.6",5,21,1941-02-02,"1941"
"1336","Febrero",2,"03/02/1941","30","2.9",3.5,19.5,1941-02-03,"1941"
"1337","Febrero",2,"04/02/1941","80","2.7",7.5,17,1941-02-04,"1941"
"1338","Febrero",2,"05/02/1941","30","1.3",8.5,14,1941-02-05,"1941"
"1339","Febrero",2,"06/02/1941","0","6.5",3,20.5,1941-02-06,"1941"
"1340","Febrero",2,"07/02/1941","0","8.3",3.5,19.5,1941-02-07,"1941"
"1341","Febrero",2,"08/02/1941","0","4.9",1,19,1941-02-08,"1941"
"1342","Febrero",2,"09/02/1941","0","3.9",-3.5,17.5,1941-02-09,"1941"
"1343","Febrero",2,"10/02/1941","0","5.3",-3,24,1941-02-10,"1941"
"1344","Febrero",2,"11/02/1941","0","5.3",1,22.5,1941-02-11,"1941"
"1345","Febrero",2,"12/02/1941","0","1.2",4,26,1941-02-12,"1941"
"1346","Febrero",2,"13/02/1941","0","7.9",8.5,28.5,1941-02-13,"1941"
"1347","Febrero",2,"14/02/1941","0","8.3",4.5,29.5,1941-02-14,"1941"
"1348","Febrero",2,"15/02/1941","0","8.1",5.5,29.5,1941-02-15,"1941"
"1349","Febrero",2,"16/02/1941","0","8.6",7,28.5,1941-02-16,"1941"
"1350","Febrero",2,"17/02/1941","0","6",8.5,22,1941-02-17,"1941"
"1351","Febrero",2,"18/02/1941","0","6.5",3.5,21.5,1941-02-18,"1941"
"1352","Febrero",2,"19/02/1941","0","1.7",4.5,25.5,1941-02-19,"1941"
"1353","Febrero",2,"20/02/1941","0","6.4",7,24.5,1941-02-20,"1941"
"1354","Febrero",2,"21/02/1941","0","8.4",9.5,26.5,1941-02-21,"1941"
"1355","Febrero",2,"22/02/1941","0","11.7",10.5,26,1941-02-22,"1941"
"1356","Febrero",2,"23/02/1941","0","9",4.5,21.5,1941-02-23,"1941"
"1357","Febrero",2,"24/02/1941","0","9.4",1.5,22.5,1941-02-24,"1941"
"1358","Febrero",2,"25/02/1941","0","9.9",3.5,22.5,1941-02-25,"1941"
"1359","Febrero",2,"26/02/1941","0","13.5",3.5,23.5,1941-02-26,"1941"
"1360","Febrero",2,"27/02/1941","0","6",3,23,1941-02-27,"1941"
"1361","Febrero",2,"28/02/1941","0","6.5",5.5,25,1941-02-28,"1941"
"1362","Febrero",2,"01/02/1942","0","5.6",2,23.5,1942-02-01,"1942"
"1363","Febrero",2,"02/02/1942","27.5","3",1,24,1942-02-02,"1942"
"1364","Febrero",2,"03/02/1942","0","2.8",6,19.5,1942-02-03,"1942"
"1365","Febrero",2,"04/02/1942","5","2.4",6.5,23.5,1942-02-04,"1942"
"1366","Febrero",2,"05/02/1942","0","2.1",8.5,24,1942-02-05,"1942"
"1367","Febrero",2,"06/02/1942","15","2",10.5,25.5,1942-02-06,"1942"
"1368","Febrero",2,"07/02/1942","0","1.5",10.5,22.5,1942-02-07,"1942"
"1369","Febrero",2,"08/02/1942","0","5.7",11,22.5,1942-02-08,"1942"
"1370","Febrero",2,"09/02/1942","0","9.8",11.5,22.5,1942-02-09,"1942"
"1371","Febrero",2,"10/02/1942","0","6.4",7.5,21,1942-02-10,"1942"
"1372","Febrero",2,"11/02/1942","0","6.6",4.5,20.5,1942-02-11,"1942"
"1373","Febrero",2,"12/02/1942","0","6",2.5,19,1942-02-12,"1942"
"1374","Febrero",2,"13/02/1942","0","5.6",7.5,18.5,1942-02-13,"1942"
"1375","Febrero",2,"14/02/1942","0","5.3",4,18.5,1942-02-14,"1942"
"1376","Febrero",2,"15/02/1942","18","6.1",5,20,1942-02-15,"1942"
"1377","Febrero",2,"16/02/1942","0","7.4",8,15.5,1942-02-16,"1942"
"1378","Febrero",2,"17/02/1942","0","4.7",-1,20.5,1942-02-17,"1942"
"1379","Febrero",2,"18/02/1942","0","5.5",5.5,21,1942-02-18,"1942"
"1380","Febrero",2,"19/02/1942","0","7.8",-2,23.5,1942-02-19,"1942"
"1381","Febrero",2,"20/02/1942","0","4",-2,23.5,1942-02-20,"1942"
"1382","Febrero",2,"21/02/1942","0","6.3",2,24,1942-02-21,"1942"
"1383","Febrero",2,"22/02/1942","0","9.9",4,25.5,1942-02-22,"1942"
"1384","Febrero",2,"23/02/1942","0","1",8.5,25.5,1942-02-23,"1942"
"1385","Febrero",2,"24/02/1942","0","9",8.5,27,1942-02-24,"1942"
"1386","Febrero",2,"25/02/1942","0","11.4",9,24.5,1942-02-25,"1942"
"1387","Febrero",2,"26/02/1942","0","8.8",6.5,27.5,1942-02-26,"1942"
"1388","Febrero",2,"27/02/1942","0","9.9",7,24.5,1942-02-27,"1942"
"1389","Febrero",2,"28/02/1942","0","12",9.5,23.5,1942-02-28,"1942"
"1390","Febrero",2,"01/02/1943","0","4.7",2.5,24.5,1943-02-01,"1943"
"1391","Febrero",2,"02/02/1943","0","7",2,24.5,1943-02-02,"1943"
"1392","Febrero",2,"03/02/1943","0","6.3",6,24,1943-02-03,"1943"
"1393","Febrero",2,"04/02/1943","0","6.5",6,20,1943-02-04,"1943"
"1394","Febrero",2,"05/02/1943","0","3.5",-2,22,1943-02-05,"1943"
"1395","Febrero",2,"06/02/1943","0","6.8",0,23,1943-02-06,"1943"
"1396","Febrero",2,"07/02/1943","0","4.2",-3,26,1943-02-07,"1943"
"1397","Febrero",2,"08/02/1943","0","10.8",3,28,1943-02-08,"1943"
"1398","Febrero",2,"09/02/1943","0","10.9",5,25,1943-02-09,"1943"
"1399","Febrero",2,"10/02/1943","0","7",6,25,1943-02-10,"1943"
"1400","Febrero",2,"11/02/1943","0","4.4",-2,20,1943-02-11,"1943"
"1401","Febrero",2,"12/02/1943","0","7.5",-2,22,1943-02-12,"1943"
"1402","Febrero",2,"13/02/1943","0","5.6",-2,17,1943-02-13,"1943"
"1403","Febrero",2,"14/02/1943","0","3.8",-3,19,1943-02-14,"1943"
"1404","Febrero",2,"15/02/1943","0","6",0,22.5,1943-02-15,"1943"
"1405","Febrero",2,"16/02/1943","0","3.8",1.5,19,1943-02-16,"1943"
"1406","Febrero",2,"17/02/1943","0","6.5",6.5,23.5,1943-02-17,"1943"
"1407","Febrero",2,"18/02/1943","0","5.2",-0.5,22,1943-02-18,"1943"
"1408","Febrero",2,"19/02/1943","0","4.4",-1,24.5,1943-02-19,"1943"
"1409","Febrero",2,"20/02/1943","0","7.6",-1.5,25,1943-02-20,"1943"
"1410","Febrero",2,"21/02/1943","0","6",2.5,25,1943-02-21,"1943"
"1411","Febrero",2,"22/02/1943","0","10.1",4,26,1943-02-22,"1943"
"1412","Febrero",2,"23/02/1943","0","10",3,26,1943-02-23,"1943"
"1413","Febrero",2,"24/02/1943","0","8.2",-1,25,1943-02-24,"1943"
"1414","Febrero",2,"25/02/1943","0","9.8",1,29,1943-02-25,"1943"
"1415","Febrero",2,"26/02/1943","0","8.9",2.5,27.5,1943-02-26,"1943"
"1416","Febrero",2,"27/02/1943","0","10.4",4,27,1943-02-27,"1943"
"1417","Febrero",2,"28/02/1943","0","11.6",4,25.5,1943-02-28,"1943"
"1418","Febrero",2,"01/02/1944","10","2.3",5.5,19,1944-02-01,"1944"
"1419","Febrero",2,"02/02/1944","3","0.4",8,15,1944-02-02,"1944"
"1420","Febrero",2,"03/02/1944","0","0.6",7,16.5,1944-02-03,"1944"
"1421","Febrero",2,"04/02/1944","0","4.6",3,22,1944-02-04,"1944"
"1422","Febrero",2,"05/02/1944","0","3.8",6,21,1944-02-05,"1944"
"1423","Febrero",2,"06/02/1944","0","2.8",5,23,1944-02-06,"1944"
"1424","Febrero",2,"07/02/1944","0","6.7",10,24.5,1944-02-07,"1944"
"1425","Febrero",2,"08/02/1944","0","8.3",8.5,25,1944-02-08,"1944"
"1426","Febrero",2,"09/02/1944","0","7.8",8,24.5,1944-02-09,"1944"
"1427","Febrero",2,"10/02/1944","0","4.9",7.5,20.5,1944-02-10,"1944"
"1428","Febrero",2,"11/02/1944","0","4.2",5.5,21,1944-02-11,"1944"
"1429","Febrero",2,"12/02/1944","0","7.7",-2,21.5,1944-02-12,"1944"
"1430","Febrero",2,"13/02/1944","0","9.6",0,23.5,1944-02-13,"1944"
"1431","Febrero",2,"14/02/1944","0","9.2",0,22.5,1944-02-14,"1944"
"1432","Febrero",2,"15/02/1944","0","9.8",3.5,23,1944-02-15,"1944"
"1433","Febrero",2,"16/02/1944","0","5.5",2,22,1944-02-16,"1944"
"1434","Febrero",2,"17/02/1944","0","10",2.5,25,1944-02-17,"1944"
"1435","Febrero",2,"18/02/1944","0","7.4",5,24.5,1944-02-18,"1944"
"1436","Febrero",2,"19/02/1944","0","9.9",4,23,1944-02-19,"1944"
"1437","Febrero",2,"20/02/1944","0","7.2",3.5,24,1944-02-20,"1944"
"1438","Febrero",2,"21/02/1944","0","5.9",2,26,1944-02-21,"1944"
"1439","Febrero",2,"22/02/1944","0","7.5",1,27,1944-02-22,"1944"
"1440","Febrero",2,"23/02/1944","0","8.8",4,24,1944-02-23,"1944"
"1441","Febrero",2,"24/02/1944","0","10.8",7,22,1944-02-24,"1944"
"1442","Febrero",2,"25/02/1944","0","9.6",6,22.5,1944-02-25,"1944"
"1443","Febrero",2,"26/02/1944","0","9.1",2.5,22,1944-02-26,"1944"
"1444","Febrero",2,"27/02/1944","0","7.9",2,23,1944-02-27,"1944"
"1445","Febrero",2,"28/02/1944","0","7.1",1.5,25,1944-02-28,"1944"
"1446","Febrero",2,"29/02/1944","0","8",1.5,25,1944-02-29,"1944"
"1447","Febrero",2,"01/02/1945","0","7.8",2,27,1945-02-01,"1945"
"1448","Febrero",2,"02/02/1945","0","5",1,26,1945-02-02,"1945"
"1449","Febrero",2,"03/02/1945","0","4.9",2.5,25,1945-02-03,"1945"
"1450","Febrero",2,"04/02/1945","0","6.1",1,24,1945-02-04,"1945"
"1451","Febrero",2,"05/02/1945","0","5.4",-2.5,24.5,1945-02-05,"1945"
"1452","Febrero",2,"06/02/1945","0","8.2",-4,26,1945-02-06,"1945"
"1453","Febrero",2,"07/02/1945","0","5.2",-3,25,1945-02-07,"1945"
"1454","Febrero",2,"08/02/1945","0","4.5",-1.5,27,1945-02-08,"1945"
"1455","Febrero",2,"09/02/1945","0","10.1",-1.5,25,1945-02-09,"1945"
"1456","Febrero",2,"10/02/1945","2","3",-1,24,1945-02-10,"1945"
"1457","Febrero",2,"11/02/1945","10","4.5",-2,24,1945-02-11,"1945"
"1458","Febrero",2,"12/02/1945","0","4.4",-1.5,20,1945-02-12,"1945"
"1459","Febrero",2,"13/02/1945","0","5.8",-4.5,25.5,1945-02-13,"1945"
"1460","Febrero",2,"14/02/1945","0","5.1",-3,26.5,1945-02-14,"1945"
"1461","Febrero",2,"15/02/1945","0","7.4",-1,23.5,1945-02-15,"1945"
"1462","Febrero",2,"16/02/1945","0","10.3",0,22,1945-02-16,"1945"
"1463","Febrero",2,"17/02/1945","0","7.3",3,22,1945-02-17,"1945"
"1464","Febrero",2,"18/02/1945","0","5.4",2.5,25,1945-02-18,"1945"
"1465","Febrero",2,"19/02/1945","0","7.7",7,24,1945-02-19,"1945"
"1466","Febrero",2,"20/02/1945","0","6.5",7,22.5,1945-02-20,"1945"
"1467","Febrero",2,"21/02/1945","0","12.1",6.5,22,1945-02-21,"1945"
"1468","Febrero",2,"22/02/1945","0","5",0,22,1945-02-22,"1945"
"1469","Febrero",2,"23/02/1945","0","8.6",-3,20,1945-02-23,"1945"
"1470","Febrero",2,"24/02/1945","0","1.9",0,25,1945-02-24,"1945"
"1471","Febrero",2,"25/02/1945","0","9.2",4,24.5,1945-02-25,"1945"
"1472","Febrero",2,"26/02/1945","0","9.5",5,25,1945-02-26,"1945"
"1473","Febrero",2,"27/02/1945","0","4.8",2.5,21.5,1945-02-27,"1945"
"1474","Febrero",2,"28/02/1945","0","1.7",2,23.5,1945-02-28,"1945"
"1475","Febrero",2,"01/02/1946","0","6.7",3,24.5,1946-02-01,"1946"
"1476","Febrero",2,"02/02/1946","0","7.3",3.5,23,1946-02-02,"1946"
"1477","Febrero",2,"03/02/1946","0","4.9",5,22,1946-02-03,"1946"
"1478","Febrero",2,"04/02/1946","0","9.5",7,21.5,1946-02-04,"1946"
"1479","Febrero",2,"05/02/1946","0","4.5",4.5,22.5,1946-02-05,"1946"
"1480","Febrero",2,"06/02/1946","0","5.6",5.5,22.5,1946-02-06,"1946"
"1481","Febrero",2,"07/02/1946","0","6",6,21,1946-02-07,"1946"
"1482","Febrero",2,"08/02/1946","0","5.3",7.5,20.5,1946-02-08,"1946"
"1483","Febrero",2,"09/02/1946","0","10.4",7,21,1946-02-09,"1946"
"1484","Febrero",2,"10/02/1946","0","4.5",0,21,1946-02-10,"1946"
"1485","Febrero",2,"11/02/1946","0","9.3",0,22,1946-02-11,"1946"
"1486","Febrero",2,"12/02/1946","0","9.5",5,17,1946-02-12,"1946"
"1487","Febrero",2,"13/02/1946","0","9.2",2,21.5,1946-02-13,"1946"
"1488","Febrero",2,"14/02/1946","0","2.5",-3.5,18.5,1946-02-14,"1946"
"1489","Febrero",2,"15/02/1946","0","7.4",-5,22.5,1946-02-15,"1946"
"1490","Febrero",2,"16/02/1946","0","12.6",-5,22,1946-02-16,"1946"
"1491","Febrero",2,"17/02/1946","0","5.7",0,23,1946-02-17,"1946"
"1492","Febrero",2,"18/02/1946","0","6.1",9,21.5,1946-02-18,"1946"
"1493","Febrero",2,"19/02/1946","0","5.3",5.5,21,1946-02-19,"1946"
"1494","Febrero",2,"20/02/1946","0","6.9",2.5,21.5,1946-02-20,"1946"
"1495","Febrero",2,"21/02/1946","0","5.1",4.5,20.5,1946-02-21,"1946"
"1496","Febrero",2,"22/02/1946","0","6.5",1.5,21.5,1946-02-22,"1946"
"1497","Febrero",2,"23/02/1946","0","7.2",2.5,21.5,1946-02-23,"1946"
"1498","Febrero",2,"24/02/1946","0","8.9",5.5,23.5,1946-02-24,"1946"
"1499","Febrero",2,"25/02/1946","0","2.3",1.5,23.5,1946-02-25,"1946"
"1500","Febrero",2,"26/02/1946","0","8.1",3,20.5,1946-02-26,"1946"
"1501","Febrero",2,"27/02/1946","0","4.9",-1,17,1946-02-27,"1946"
"1502","Febrero",2,"28/02/1946","0","6.3",-3,20,1946-02-28,"1946"
"1503","Febrero",2,"01/02/1947","0","6",1.5,22,1947-02-01,"1947"
"1504","Febrero",2,"02/02/1947","0","4.1",1,20,1947-02-02,"1947"
"1505","Febrero",2,"03/02/1947","0","4.6",3.5,24.5,1947-02-03,"1947"
"1506","Febrero",2,"04/02/1947","0","6.6",1.5,20.5,1947-02-04,"1947"
"1507","Febrero",2,"05/02/1947","0","7.6",1.5,24.5,1947-02-05,"1947"
"1508","Febrero",2,"06/02/1947","0","6.9",1.5,23.5,1947-02-06,"1947"
"1509","Febrero",2,"07/02/1947","0","5.4",4.5,24,1947-02-07,"1947"
"1510","Febrero",2,"08/02/1947","0","5.4",4.5,19,1947-02-08,"1947"
"1511","Febrero",2,"09/02/1947","0","5.9",3.5,23,1947-02-09,"1947"
"1512","Febrero",2,"10/02/1947","0","5.6",9,18.5,1947-02-10,"1947"
"1513","Febrero",2,"11/02/1947","0","7",2.5,21,1947-02-11,"1947"
"1514","Febrero",2,"12/02/1947","0","5.6",0,18.5,1947-02-12,"1947"
"1515","Febrero",2,"13/02/1947","0","6.2",-1.5,19,1947-02-13,"1947"
"1516","Febrero",2,"14/02/1947","0","4.5",0,21.5,1947-02-14,"1947"
"1517","Febrero",2,"15/02/1947","0","5.3",1,20.5,1947-02-15,"1947"
"1518","Febrero",2,"16/02/1947","0","6",1,22.5,1947-02-16,"1947"
"1519","Febrero",2,"17/02/1947","0","10.8",4,20,1947-02-17,"1947"
"1520","Febrero",2,"18/02/1947","0","8.3",3,22,1947-02-18,"1947"
"1521","Febrero",2,"19/02/1947","0","1.2",5,21,1947-02-19,"1947"
"1522","Febrero",2,"20/02/1947","0","8.7",1.5,21.5,1947-02-20,"1947"
"1523","Febrero",2,"21/02/1947","0","9.2",2,22.5,1947-02-21,"1947"
"1524","Febrero",2,"22/02/1947","0","6.8",3.5,23,1947-02-22,"1947"
"1525","Febrero",2,"23/02/1947","0","7.8",0.5,22.5,1947-02-23,"1947"
"1526","Febrero",2,"24/02/1947","0","7.8",2.5,23,1947-02-24,"1947"
"1527","Febrero",2,"25/02/1947","0","10",4,24,1947-02-25,"1947"
"1528","Febrero",2,"26/02/1947","0","7.9",8,23.5,1947-02-26,"1947"
"1529","Febrero",2,"27/02/1947","0","8.8",8.5,20.5,1947-02-27,"1947"
"1530","Febrero",2,"28/02/1947","0","10.8",6,22,1947-02-28,"1947"
"1531","Febrero",2,"01/02/1948","6","9.8",0.5,11,1948-02-01,"1948"
"1532","Febrero",2,"02/02/1948","5","2.8",5,15.5,1948-02-02,"1948"
"1533","Febrero",2,"03/02/1948","0","4.9",5.5,22.5,1948-02-03,"1948"
